commit	mission_reward	secondary_rewards	steps	status	description
6354a2c	0.349000	junction.held=2990;junction.gained=9;heart.withdrawn=8;aligner.gained=2;miner.gained=5	500	discard	Baseline: 8-agent cross_role 3A+5M all-LLM; 0.35/agent at 500 steps; no crash locally but retry-with-sleep present
6354a2c	0.402100	junction.held=3021;junction.gained=7;heart.withdrawn=9;aligner.gained=5;miner.gained=5	1000	keep	Fix: 8-agent cross_role 4A+4M scripted_miners=true; 0.40/agent at 1k; no retry sleep; HTTP pooling
6354a2c	0.625503	junction.held=?;junction.gained=?;heart.withdrawn=?	1000	keep	Fix: 8-agent cross_role 3A+5M all-LLM (no retry sleep + pooling); 0.63/agent but 7min wall time
6354a2c	1.341034	junction.held=3409;junction.gained=9;heart.withdrawn=10;clips_held=1184541	10000	keep	Fix: 8-agent cross_role 4A+4M scripted_miners=true at 10k steps; NO CRASH; qualifying scenario passed
6354a2c	0.190000	junction.held=?;junction.gained=?;heart.withdrawn=?	500	discard	Fix: 8-agent cross_role 3A+5M scripted_miners=true; 0.19/agent; fewer aligners = less alignment
6354a2c	0.240000	junction.held=?;junction.gained=?;heart.withdrawn=?	1000	discard	Fix: 8-agent cross_role 5A+3M scripted_miners=true; 0.24/agent; too many LLM agents
6354a2c	0.590000	junction.held=?;junction.gained=?;heart.withdrawn=?	1000	keep	Comparison: MachinaLLMRolesPolicy 4A+4M scripted_miners at 1k; 0.59/agent reference point
6354a2c	0.449596	junction.held=3496;junction.gained=5;heart.withdrawn=7	1000	keep	Fix: 8-agent cross_role 4A+4M all-LLM (no scripted_miners) at 1k; 0.45/agent
d6c6270	0.429198	junction.held=3292;junction.gained=6;heart.withdrawn=9	1000	keep	Fix: 8-agent cross_role 4A+4M scripted_miners+stuck_aware at 1k; 0.43/agent (+7.5% vs 0.40)
6354a2c	0.182002	junction.held=820;junction.gained=1;heart.withdrawn=6	1000	discard	Fix: 8-agent cross_role 2A+6M all-LLM at 1k; too few aligners
6354a2c	0.196202	junction.held=962;junction.gained=1;heart.withdrawn=5	1000	discard	Fix: 8-agent cross_role 3A+5M gemma-3-12b:free at 1k; all LLM calls failed (rate limited)
6354a2c	1.609440	junction.held=?;junction.gained=?;heart.withdrawn=?	10000	keep	Fix: 8-agent cross_role 3A+5M all-LLM nemotron at 10k; BEST RESULT 1.61/agent; NO CRASH; 68min
d6c6270	0.597305	junction.held=4973;junction.gained=8;heart.withdrawn=5	1000	keep	Fix: 8-agent cross_role 3A+5M all-LLM nemotron stuck-aware at 1k; 0.60/agent
d6c6270	0.540103	junction.held=4401;junction.gained=7;heart.withdrawn=5	1000	keep	Fix: 8-agent cross_role 3A+5M gemma-3-12b-it paid at 1k; 0.54/agent; works but slower
d6c6270	0.661806	junction.held=?;junction.gained=?;heart.withdrawn=?	1000	keep	Fix: 8-agent cross_role 3A+5M llm_timeout=5s at 1k; 0.66/agent; faster timeout = less blocking
d6c6270	0.625503	junction.held=5255;junction.gained=10;heart.withdrawn=8	1000	keep	Fix: 8-agent cross_role 3A+5M llm_timeout=5s (run2) at 1k; 0.63/agent
d6c6270	0.495198	junction.held=?;junction.gained=?;heart.withdrawn=?	1000	discard	Fix: 8-agent cross_role 3A+5M stuck_threshold=15 at 1k; 0.50/agent; too frequent replanning
d6c6270	0.434701	junction.held=?;junction.gained=?;heart.withdrawn=?	1000	discard	Fix: 8-agent cross_role 3A+5M stuck_threshold=25 at 1k; 0.43/agent
d6c6270	0.374696	junction.held=?;junction.gained=?;heart.withdrawn=?	1000	discard	Fix: 8-agent cross_role 3A+5M return_load=20 at 1k; too many short trips
d6c6270	0.370000	junction.held=2714;junction.gained=4;heart.withdrawn=5	1000	discard	Fix: 8-agent cross_role 3A+5M return_load=60 at 1k; miners die before depositing
d6c6270	1.500000	junction.held=?;junction.gained=?;heart.withdrawn=9	10000	keep	Comparison: MachinaLLMRolesPolicy 4A+4M scripted_miners at 10k; 1.50/agent; 67min
6f6fa6d	0.196000	junction.held=?;junction.gained=?;heart.withdrawn=5	1000	keep	Fix: 8-agent cross_role 3A+5M NO API KEY (all scripted fallback); 0.20/agent; 1m11s; no crash
