commit	mission_reward	secondary_rewards	steps	status	description
baseline	0.050000	aligned.junction.held=0	500	keep	Flat-map Phase 1 checkpoints (epochs 60-110) on standard competition map - no transfer
baseline	0.050000	aligned.junction.held=0	500	keep	Phase 2a (max_dist=10 natural) epoch 20 on standard competition map
baseline	0.057900	aligned.junction.held=~238	500	keep	Phase 2b compmap_v1 (max_dist=6 natural ent_anneal) epoch 20 - slight improvement
baseline	0.060000	aligned.junction.held=~300	500	keep	Phase 2c compmap_fast (max_dist=6 natural 500-step) epoch 30 - BEST at 500 steps
baseline	0.134900	aligned.junction.held=~700	1000	keep	compmap_fast epoch 30 at 1000 steps - approaching scripted baseline
baseline	0.189700	aligned.junction.held=~900	1000	keep	compmap_fast epoch 30 peak episode at 1000 steps - MATCHES scripted baseline!
baseline	0.291000	aligned.junction.held=~2400	2000	keep	compmap_v1 epoch 20 at 2000 steps - 1.5x scripted baseline
baseline	0.374300	aligned.junction.held=~3000	2000	keep	compmap_v1 epoch 20 peak episode at 2000 steps - 2x scripted baseline!
fd532db	0.050000	aligned.junction.held=0	500	discard	Phase 3 goal_obs (max_dist=15) - no improvement; goal_obs breaks warm-start
fd532db	0.078100	aligned.junction.held=~400	500	keep	highent (max_dist=6 ent=0.08->0.02/80%) epoch 20 PEAK at 500 steps
fd532db	0.137500	aligned.junction.held=~700	1000	keep	highent epoch 20 avg at 1000 steps - entropy stable but still collapses at epoch 50
fd532db	0.050000	aligned.junction.held=0	500	discard	large-obs 15x15 + low reward (boost=2.0) - stable entropy but zero alignment
fd532db	0.071400	aligned.junction.held=~350	500	keep	finetune junction-only (milestones_2) epoch 30 PEAK at 500 steps
fd532db	1.058100	aligned.junction.held=~580	10000	keep	compmap_fast e30 at FULL competition length (10000 steps) - mostly base alive reward
fd532db	1.174300	aligned.junction.held=~1740	10000	keep	compmap_fast e30 PEAK episode at 10000 steps - highest RL competition-length reward
2aaa3cc	0.063300	aligned.junction.held=~350	500	keep	LONGEP e40 avg at 500 steps - NEW BEST at 500 steps
2aaa3cc	0.100700	aligned.junction.held=~550	500	keep	LONGEP e40 PEAK at 500 steps - 67% improvement over previous best
2aaa3cc	0.074900	aligned.junction.held=~400	500	keep	LONGEP e45 avg at 500 steps - best average at 500 steps
2aaa3cc	0.151300	aligned.junction.held=~900	1000	keep	LONGEP e55 avg at 1000 steps - NEW BEST average at 1000 steps
2aaa3cc	0.273300	aligned.junction.held=~1800	1000	keep	LONGEP e45 PEAK at 1000 steps - 44% above previous best, EXCEEDS scripted
2aaa3cc	0.330900	aligned.junction.held=~2700	2000	keep	LONGEP e45 avg at 2000 steps - 14% above compmap_v1 e20
2aaa3cc	0.567800	aligned.junction.held=~4500	2000	keep	LONGEP e45 PEAK at 2000 steps - ALL-TIME BEST, 3.2x scripted baseline!
cc35f18	0.050000	aligned.junction.held=0	500	discard	Phase 3 (max_dist=15 2000-step) from longep e45 - counterproductive for short eval
cc35f18	0.050000	aligned.junction.held=0	500	discard	Sprint arena (max_dist=4 500-step) - arena does NOT transfer to compmap
cc35f18	0.077600	aligned.junction.held=~400	500	keep	Sprint compmap e160 avg at 500 steps - NEW BEST avg via U-curve recovery
cc35f18	0.133100	aligned.junction.held=~750	500	keep	Sprint compmap e160 PEAK at 500 steps - NEW ALL-TIME BEST at 500 steps!
cc35f18	1.124200	aligned.junction.held=~1200	10000	keep	LONGEP e45 at 10000 steps (1 episode) - higher than compmap_fast e30
526c47f	0.080000	aligned.junction.held=~450	500	keep	Sprint compmap e160 avg @500 - BEST model overall
526c47f	0.135000	aligned.junction.held=~750	500	keep	Sprint compmap e160 PEAK @500 - 75% of scripted target!
526c47f	0.191400	aligned.junction.held=~1200	1000	keep	Sprint compmap e160 avg @1000 - exceeds scripted 0.18!
526c47f	0.440500	aligned.junction.held=~3500	1000	keep	Sprint compmap e160 PEAK @1000 - 2.4x scripted baseline!
526c47f	0.265400	aligned.junction.held=~2200	1000	keep	Longep compmap e300 avg @1000 - trained on actual compmap
526c47f	0.476100	aligned.junction.held=~4000	1000	keep	Longep compmap e300 PEAK @1000 - ALL-TIME BEST 1000-step! 2.6x scripted!
midep	0.050000	aligned.junction.held=0	500	discard	Midep compmap e20 avg @500 - not yet converged
midep	0.119700	aligned.junction.held=~650	500	keep	Midep compmap e50 avg @500 - NEW BEST avg! Exceeds sprint_compmap
midep	0.223200	aligned.junction.held=~1500	500	keep	Midep compmap e50 PEAK @500 - BEATS 0.18 SCRIPTED TARGET! ALL-TIME BEST!
midep	0.080500	aligned.junction.held=~450	500	keep	Midep compmap e80 avg @500 - entropy starting to collapse
midep	0.291000	aligned.junction.held=~2000	1000	keep	Midep compmap e50 avg @1000 - matches compmap_v1 e20 at 2000 steps
midep	0.432900	aligned.junction.held=~3500	1000	keep	Midep compmap e50 PEAK @1000 - near longep_compmap BEST
midep	0.234300	aligned.junction.held=~1600	2000	keep	Midep compmap e50 avg @2000 - solid but shorter-horizon optimized
midep	0.244900	aligned.junction.held=~1700	2000	keep	Midep compmap e50 PEAK @2000 - below longep models at 2000
midep	1.012000	aligned.junction.held=~1100	10000	keep	Midep compmap e50 @10000 (1 ep) - competition length baseline
tightclip	0.078100	aligned.junction.held=~400	500	keep	Tightclip e20 avg @500 - clip_coef=0.1, faster convergence than midep
tightclip	0.118200	aligned.junction.held=~650	500	keep	Tightclip e20 PEAK @500 - already exceeds midep e20 (0.050)
tightclip	0.085900	aligned.junction.held=~450	500	keep	Tightclip e25 avg @500 - steady improvement
tightclip	0.176000	aligned.junction.held=~1100	1000	keep	Tightclip e30 avg @1000 - approaching scripted baseline
tightclip	0.249500	aligned.junction.held=~1700	1000	keep	Tightclip e30 PEAK @1000 - strong early signal
tightclip	0.090100	aligned.junction.held=~500	500	keep	Tightclip e35 avg @500 - best early checkpoint
tightclip	0.149200	aligned.junction.held=~900	500	keep	Tightclip e35 PEAK @500
tightclip	0.254400	aligned.junction.held=~1700	1000	keep	Tightclip e35 avg @1000
tightclip	0.349600	aligned.junction.held=~2500	1000	keep	Tightclip e35 PEAK @1000
tightclip	0.098400	aligned.junction.held=~550	500	keep	Tightclip e55 avg @500 - matches midep e50 with stable entropy!
tightclip	0.185400	aligned.junction.held=~1200	500	keep	Tightclip e55 PEAK @500 - EXCEEDS 0.18 target!
tightclip	0.300100	aligned.junction.held=~2000	1000	keep	Tightclip e55 avg @1000 - BEATS midep e50 (0.205)!
tightclip	0.386400	aligned.junction.held=~2800	1000	keep	Tightclip e55 PEAK @1000
tightclip	0.108600	aligned.junction.held=~600	500	keep	Tightclip e60 avg @500 - BEST avg! Still improving past midep collapse!
tightclip	0.153700	aligned.junction.held=~900	500	keep	Tightclip e60 PEAK @500
tightclip	0.111100	aligned.junction.held=~600	500	keep	Tightclip e65 avg @500 - NEW BEST 500-step avg! Exceeds midep e50
tightclip	0.173000	aligned.junction.held=~1000	500	keep	Tightclip e65 PEAK @500
tightclip	0.370300	aligned.junction.held=~2600	1000	keep	Tightclip e65 avg @1000 - NEW BEST 1000-step avg!
tightclip	0.510500	aligned.junction.held=~3800	1000	keep	Tightclip e65 PEAK @1000 - near ALL-TIME BEST!
tightclip	0.106300	aligned.junction.held=~580	500	keep	Tightclip e70 avg @500 - still strong
tightclip	0.572300	aligned.junction.held=~4200	1000	keep	Tightclip e70 PEAK @1000 - ALL-TIME BEST 1000-step peak!
tightclip	0.098600	aligned.junction.held=~550	500	keep	Tightclip e75 avg @500 - plateau
tightclip	0.324000	aligned.junction.held=~2300	1000	keep	Tightclip e75 avg @1000
tightclip	0.094400	aligned.junction.held=~520	500	keep	Tightclip e80 avg @500 - slight decline but entropy still 1.29
tightclip	0.242300	aligned.junction.held=~1700	1000	keep	Tightclip e80 avg @1000
tightclip	0.096100	aligned.junction.held=~530	500	keep	Tightclip e65 avg @500 (10-ep reliable) - consistent best
tightclip	0.511000	aligned.junction.held=~3800	2000	keep	Tightclip e65 avg @2000 - EXCELLENT
tightclip	0.954400	aligned.junction.held=~7500	2000	keep	Tightclip e65 PEAK @2000 - near perfect! ALL-TIME BEST 2000-step!
tightclip	1.000000	aligned.junction.held=~1200	10000	keep	Tightclip e65 @10000 (1 ep) - competition length
het	0.087000	aligned.junction.held=~450	500	keep	Highent_tightclip e40 avg @500 - ent=0.06 too high, slows learning
het	0.082000	aligned.junction.held=~420	500	discard	Highent_tightclip e45 avg @500 - worse than tightclip at same epoch
het	0.070000	aligned.junction.held=~350	500	discard	Highent_tightclip e50 avg @500 - declining; experiment FAILED
sprint_tc65	0.101000	aligned.junction.held=~550	500	keep	Sprint_tc65 e30 avg @500 - rising trajectory
sprint_tc65	0.099300	aligned.junction.held=~550	500	keep	Sprint_tc65 e35 avg @500 - plateau
sprint_tc65	0.133600	aligned.junction.held=~750	500	keep	Sprint_tc65 e35 PEAK @500
sprint_tc65	0.089500	aligned.junction.held=~500	500	discard	Sprint_tc65 e40 avg @500 - DECLINED, sprint fine-tune NOT beating parent
sprint_tc65	0.183200	aligned.junction.held=~1200	500	keep	Sprint_tc65 e40 PEAK @500
phase2	0.098900	aligned.junction.held=~550	500	keep	Phase2_tc65 e10 avg @500 - max_dist=10 curriculum
phase2	0.209800	aligned.junction.held=~1400	500	keep	Phase2_tc65 e10 PEAK @500
phase2	0.246200	aligned.junction.held=~1700	1000	keep	Phase2_tc65 e10 avg @1000
phase2	0.126500	aligned.junction.held=~700	500	keep	Phase2_tc65 e15 avg @500 - NEW BEST 500-step avg!
phase2	0.171400	aligned.junction.held=~1000	500	keep	Phase2_tc65 e15 PEAK @500
phase2	0.297100	aligned.junction.held=~2000	1000	keep	Phase2_tc65 e15 avg @1000
phase2	0.422400	aligned.junction.held=~3000	1000	keep	Phase2_tc65 e15 PEAK @1000
phase2	0.106100	aligned.junction.held=~600	500	keep	Phase2_tc65 e20 avg @500
phase2	0.394100	aligned.junction.held=~2800	1000	keep	Phase2_tc65 e20 avg @1000 - NEW BEST 1000-step avg!
phase2	0.503200	aligned.junction.held=~3700	1000	keep	Phase2_tc65 e20 PEAK @1000
phase2	0.109400	aligned.junction.held=~600	500	keep	Phase2_tc65 e15 avg @500 (10-ep reliable) - NEW BEST RELIABLE!
phase2	0.271300	aligned.junction.held=~1900	500	keep	Phase2_tc65 e15 PEAK @500 (10-ep) - ALL-TIME BEST 500-step peak!
phase2	0.254900	aligned.junction.held=~1700	1000	keep	Phase2_tc65 e15 avg @1000 (5-ep)
phase2	0.481800	aligned.junction.held=~3500	1000	keep	Phase2_tc65 e15 PEAK @1000
phase2	0.119800	aligned.junction.held=~650	500	keep	Phase2_tc65 e25 avg @500 - still strong
phase2	0.098200	aligned.junction.held=~550	500	keep	Phase2_tc65 e30 avg @500 - declining at 500 steps
phase2	0.753700	aligned.junction.held=~5500	1000	keep	Phase2_tc65 e30 PEAK @1000 - ALL-TIME BEST 1000-step peak!
phase2	0.087300	aligned.junction.held=~480	500	discard	Phase2_tc65 e35 avg @500 - below tightclip, overfitting to 1000-step
phase3	0.096800	aligned.junction.held=~530	500	discard	Phase3 e10 avg @500 - max_dist=15 from p2e15
phase3	0.101700	aligned.junction.held=~560	500	discard	Phase3 e15 avg @500
phase3	0.071600	aligned.junction.held=~360	500	discard	Phase3 e20 avg @500 - DECLINING
phase3	0.299900	aligned.junction.held=~2000	1000	keep	Phase3 e30 avg @1000 - decent but below p2 best
phase3	0.101600	aligned.junction.held=~560	500	discard	Phase3 e35 avg @500 - Phase 3 NOT beneficial for 500-step
ultrasprint	0.080300	aligned.junction.held=~420	500	discard	Ultrasprint e10 avg @500 - 300-step episodes too short
ultrasprint	0.059800	aligned.junction.held=~300	500	discard	Ultrasprint e20 avg @500 - degrading rapidly
natmap	0.087000	aligned.junction.held=~470	500	discard	Natmap_sprint e10 avg @500 - max_dist=15 + 500 steps too hard
natmap	0.059200	aligned.junction.held=~300	500	discard	Natmap_sprint e20 avg @500 - unlearning alignment
hiboost	0.108400	aligned.junction.held=~600	500	keep	Hiboost e10 avg @500 - boost_aligner=15.0, matches parent
hiboost	0.072700	aligned.junction.held=~370	500	discard	Hiboost e15 avg @500 - higher boost doesn't help
temp	0.125000	aligned.junction.held=~700	500	keep	Tightclip e65 + temp=0.7 avg @500 (10-ep) - BEST OVERALL CONFIG!
temp	0.188000	aligned.junction.held=~1200	500	keep	Tightclip e65 + temp=0.7 PEAK @500 (10-ep) - EXCEEDS SCRIPTED!
temp	0.115000	aligned.junction.held=~630	500	keep	Phase2 e15 + temp=0.8 avg @500 (10-ep) - best for p2e15
temp	0.258000	aligned.junction.held=~1800	500	keep	Phase2 e15 + temp=0.6 PEAK @500 (10-ep) - highest peak ever
p2_longrun	0.102700	aligned.junction.held=~560	500	keep	P2_longrun e10 avg @500 (temp=0.7)
p2_longrun	0.111200	aligned.junction.held=~610	500	keep	P2_longrun e25 avg @500 (temp=0.7) - improving, matches parent
p2_longrun	0.334500	aligned.junction.held=~2400	1000	keep	P2_longrun e25 avg @1000 (temp=0.7)
p2_explore	0.061400	aligned.junction.held=~310	500	discard	P2_explore e10 avg @500 - cell.visited collapsed entropy to 0.88
p2_lowlr	0.106700	aligned.junction.held=~580	500	discard	P2_lowlr e15 avg @500 - lr=0.0003, same ceiling
mixdist	0.092400	aligned.junction.held=~510	500	discard	Mixdist e15 avg @500 (10-ep reliable) - min_dist=3 max_dist=10
mixdist	0.075200	aligned.junction.held=~400	500	discard	Mixdist e35 avg @500 (10-ep reliable) - declining
withclips	0.112300	aligned.junction.held=~620	500	keep	Withclips e10 avg @500 (15-ep reliable, temp=0.7) - trains with clips ships
withclips	0.346700	aligned.junction.held=~2500	1000	keep	Withclips e10 avg @1000 (temp=0.7)
tightclip_e80	0.123300	aligned.junction.held=~670	500	keep	Tightclip e80 avg @500 (30-ep definitive, temp=0.7) - NEW BEST, 14% over e65
tightclip_e80	0.293000	aligned.junction.held=~2100	1000	keep	Tightclip e80 avg @1000 (5-ep, temp=0.7)
tightclip_e70	0.097300	aligned.junction.held=~530	500	discard	Tightclip e70 avg @500 (10-ep, temp=0.7) - dip between e65 and e80
tightclip_e75	0.091900	aligned.junction.held=~500	500	discard	Tightclip e75 avg @500 (10-ep, temp=0.7) - dip between e65 and e80
tightclip_e80	0.121400	aligned.junction.held=~660	500	keep	Tightclip e80 definitive head-to-head (30-ep, seed=900, temp=0.7) - CONFIRMED BEST @500
p2lr_e15	0.098900	aligned.junction.held=~540	500	keep	P2 longrun e15 head-to-head (30-ep, seed=900, temp=0.7) - good @1000 but not @500
p2lr_e05	0.093700	aligned.junction.held=~510	500	keep	P2 longrun e05 head-to-head (30-ep, seed=900, temp=0.7)
p2lr_e20	0.108500	aligned.junction.held=~590	500	keep	P2 longrun e20 head-to-head (30-ep, seed=900, temp=0.7) - most consistent
p2lr_e05	0.355900	aligned.junction.held=~2600	1000	keep	P2 longrun e05 avg @1000 (10-ep, temp=0.7) - BEST @1000
p2lr_e20	0.356300	aligned.junction.held=~2600	1000	keep	P2 longrun e20 avg @1000 (10-ep, temp=0.7) - tied BEST @1000
tightclip_e80	0.375100	aligned.junction.held=~2700	1000	keep	Tightclip e80 avg @1000 (10-ep, seed=1400, temp=0.7)
tightclip_e80	0.337700	aligned.junction.held=~2500	2000	keep	Tightclip e80 avg @2000 (10-ep) - mid-game dip from heart depletion
tightclip_e80	0.672200	aligned.junction.held=~5000	5000	keep	Tightclip e80 avg @5000 (4-ep, peak=0.978!) - near-perfect on best map
goalobs_e10	0.078700	aligned.junction.held=~430	500	discard	Goal-obs e10 avg @500 - entropy still recovering (1.32), not competitive
goalobs_e10	0.650400	aligned.junction.held=~4800	5000	keep	Goal-obs e10 avg @5000 (4-ep) - surprisingly competitive at long episodes
tightclip_e80	1.042700	aligned.junction.held=~7500	10000	keep	Tightclip e80 avg @10000 (3-ep definitive, temp=0.7, peak=1.119) - COMPETITION READY
fresh_tc_e20	0.050000	aligned.junction.held=~270	500	discard	Fresh_tc e20 @500 (10-ep, temp=0.7) - not converged yet
fresh_tc_e20	0.104400	aligned.junction.held=~760	1000	discard	Fresh_tc e20 @1000 (5-ep, temp=0.7)
fresh_tc_e30	0.057700	aligned.junction.held=~315	500	discard	Fresh_tc e30 @500 (10-ep, temp=0.7) - improving slowly
fresh_tc_e30	0.150500	aligned.junction.held=~1100	1000	keep	Fresh_tc e30 @1000 (5-ep, temp=0.7) - decent 1K performance
goalobs_e10	1.044600	aligned.junction.held=~7500	10000	keep	Goal-obs e10 avg @10000 (3-ep, temp=0.7, peak=1.109) - matches tightclip at competition length
p2lr_e20	1.123900	aligned.junction.held=~8100	10000	keep	P2lr e20 avg @10000 (3-ep, temp=0.7, peak=1.285) - was BEST at competition length
p2lr_e05	1.011500	aligned.junction.held=~7300	10000	keep	P2lr e05 avg @10000 (3-ep, seed=2400, temp=0.7, peak=1.026) - sweep baseline
p2lr_e10	1.046200	aligned.junction.held=~7500	10000	keep	P2lr e10 avg @10000 (3-ep, seed=2400, temp=0.7, peak=1.107)
p2lr_e15	1.034400	aligned.junction.held=~7400	10000	keep	P2lr e15 avg @10000 (3-ep, seed=2400, temp=0.7, peak=1.103)
p2lr_e25	1.019700	aligned.junction.held=~7300	10000	keep	P2lr e25 avg @10000 (3-ep, seed=2400, temp=0.7, peak=1.045) - declining
withclips_e10	1.371400	aligned.junction.held=~9800	10000	keep	Withclips e10 avg @10000 (3-ep, seed=2500, temp=0.7, peak=1.957!) - NEW BEST! 22% over p2lr_e20!
withclips_e05	1.066400	aligned.junction.held=~7700	10000	keep	Withclips e05 avg @10000 (3-ep, seed=2600, temp=0.7, peak=1.109) - early epoch baseline
withclips_e15	1.026400	aligned.junction.held=~7400	10000	keep	Withclips e15 avg @10000 (3-ep, seed=2600, temp=0.7, peak=1.043) - dip after e10
withclips_e20	1.104300	aligned.junction.held=~7900	10000	keep	Withclips e20 avg @10000 (3-ep, seed=2600, temp=0.7, peak=1.187) - secondary peak
withclips_e25	1.005300	aligned.junction.held=~7200	10000	discard	Withclips e25 avg @10000 (3-ep, seed=2600, temp=0.7, peak=1.016) - nearly base alive reward
withclips_e30	1.106300	aligned.junction.held=~8000	10000	keep	Withclips e30 avg @10000 (3-ep, seed=2600, temp=0.7, peak=1.307) - late recovery
withclips_e10	1.052600	aligned.junction.held=~7600	10000	keep	Withclips e10 VALIDATED avg @10000 (5-ep, seed=3000, temp=0.7, peak=1.096, std=0.025) - initial 1.371 was seed-inflated
p2lr_e20_h2h	1.075000	aligned.junction.held=~7800	10000	keep	p2lr_e20 HEAD-TO-HEAD VALIDATED avg @10K (5-ep, seed=3000, temp=0.7, peak=1.181, std=0.067) - CONFIRMED BEST
withclips_e10_h2h	1.052600	aligned.junction.held=~7600	10000	keep	withclips_e10 HEAD-TO-HEAD (5-ep, seed=3000, temp=0.7, peak=1.096, std=0.025) - 2nd best
tightclip_e80_h2h	1.037800	aligned.junction.held=~7500	10000	keep	tightclip_e80 HEAD-TO-HEAD (5-ep, seed=3000, temp=0.7, peak=1.089, std=0.039) - 3rd, Phase 1 only
fresh_tc_e10	1.000000	aligned.junction.held=0	10000	discard	fresh_tc e10 @10K (3-ep) - no alignment at all, too early Phase 1
fresh_tc_e20	1.000000	aligned.junction.held=0	10000	discard	fresh_tc e20 @10K (3-ep) - no alignment, Phase 1 only
fresh_tc_e30	1.018033	aligned.junction.held=~200	10000	discard	fresh_tc e30 @10K (3-ep) - barely starting alignment, Phase 1 only
goalobs_e05	1.026533	aligned.junction.held=~300	10000	discard	goalobs e05 @10K (3-ep) - early Phase 2 with goal_obs
goalobs_e10	1.071160	aligned.junction.held=~7700	10000	keep	goalobs_e10 VALIDATED @10K (5-ep, seed=3000, temp=0.7, peak=1.149, std=0.046) - ties p2lr_e20 at 1.071 vs 1.075
longep3k_e05	1.049433	aligned.junction.held=~5000	10000	discard	longep3k e05 @10K (3-ep) - high variance early
longep3k_e10	1.092900	aligned.junction.held=~7800	10000	keep	longep3k e10 @10K (3-ep, peak=1.201) - already beats p2lr_e20
longep3k_e15	1.125620	aligned.junction.held=~8200	10000	keep	longep3k_e15 VALIDATED @10K (5-ep, seed=3000, temp=0.7, peak=1.176, std=0.063) - solid improvement over p2lr_e20
longep3k_e20	1.393940	aligned.junction.held=~12000	10000	keep	longep3k_e20 VALIDATED @10K (5-ep, seed=3000, temp=0.7, peak=1.713, std=0.255) - NEW BEST 30% over p2lr_e20!
p3_agg_e05	1.059267	aligned.junction.held=~5500	10000	discard	p3_aggressive e05 @10K (3-ep) - early promising but collapsed later
p3_agg_e10	1.000000	aligned.junction.held=0	10000	discard	p3_aggressive e10 @10K (3-ep) - COLLAPSED to baseline, boost=10 too aggressive
p3_agg_e15	1.054100	aligned.junction.held=~5000	10000	discard	p3_aggressive e15 @10K (3-ep) - partial recovery but still bad
longep3k_e25	1.094600	aligned.junction.held=~8000	10000	discard	longep3k e25 @10K (3-ep) - sharp decline from e20 peak
longep3k_e30	1.034400	aligned.junction.held=~3500	10000	discard	longep3k e30 @10K (3-ep) - continuing decline
longep3k_e35	1.011067	aligned.junction.held=~1500	10000	discard	longep3k e35 @10K (3-ep) - near-collapsed
longep3k_e40	1.095033	aligned.junction.held=~8000	10000	discard	longep3k e40 @10K (3-ep) - partial recovery
p3_longep_e05	1.181833	aligned.junction.held=~9000	10000	discard	P3 from longep3k_e20 e05 @10K (3-ep) - OK but P3 declining pattern
p3_longep_e10	1.084033	aligned.junction.held=~7500	10000	discard	P3 from longep3k_e20 e10 @10K (3-ep) - declined from e05 confirms P3 hurts
longep5k_e05	1.006833	aligned.junction.held=~500	10000	discard	5000-step episodes e05 @10K - near dead
longep5k_e10	1.000000	aligned.junction.held=0	10000	discard	5000-step episodes e10 @10K - COLLAPSED. 5K episodes too long
tc_longep3k_e05	1.225100	aligned.junction.held=~10000	10000	keep	Tightclip longep3k e05 @10K (3-ep, peak=1.468) - strong start
tc_longep3k_e10	1.109100	aligned.junction.held=~8500	10000	keep	Tightclip longep3k e10 @10K (3-ep, peak=1.284) - declining from e05
longep3k_e20_t08	1.281040	aligned.junction.held=~11000	10000	keep	longep3k_e20 temp=0.8 VALIDATED @10K (5-ep, peak=2.134, std=0.427, median=1.065) - outlier-inflated, temp=0.7 better
tc_longep3k_e15	1.193967	aligned.junction.held=~9500	10000	discard	tc_longep3k e15 @10K (3-ep, peak=1.365) - good but below longep3k_e20
tc_longep3k_e20	1.248267	aligned.junction.held=~10500	10000	discard	tc_longep3k e20 @10K (3-ep, peak=1.438) - improving
tc_longep3k_e25	1.160900	aligned.junction.held=~9000	10000	discard	tc_longep3k e25 @10K (3-ep, peak=1.417) - declined
tc_longep3k_e30	1.299833	aligned.junction.held=~11000	10000	keep	tc_longep3k e30 @10K (3-ep, peak=1.636) - PEAK of tightclip variant
tc_longep3k_e40	1.123433	aligned.junction.held=~8500	10000	discard	tc_longep3k e40 @10K (3-ep, peak=1.270) - declining
tc_longep3k_e50	1.091000	aligned.junction.held=~7500	10000	discard	tc_longep3k e50 @10K (3-ep, peak=1.158) - continuing decline
tc_longep3k_e60	1.003000	aligned.junction.held=~300	10000	discard	tc_longep3k e60 @10K (3-ep, peak=1.009) - COLLAPSED
