commit	mission_reward	secondary_rewards	steps	status	description
15a8c95	34.256046	hearts=17 junctions=17	500	keep	baseline 500 steps 8 cogs seed 42 - all session 13+14 fixes merged
15a8c95	789.180542	hearts=47 junctions=43	3000	keep	baseline 3000 steps 8 cogs seed 42 - full episode
15a8c95	18.256039	hearts=18 junctions=16	500	keep	baseline 500 steps 4 cogs seed 42 - role allocation fix verified (2m+2a)
c908949	38.640011	hearts=23 junctions=23	500	keep	hub approach diversification - 8 cogs seed 42 (+12.8% vs baseline)
c908949	839.352295	hearts=45 junctions=42	3000	keep	hub approach diversification - 8 cogs seed 42 (+6.4% vs baseline)
c908949	567.031982	hearts=28 junctions=?	3000	keep	hub approach diversification - 8 cogs seed 123 (neutral)
0435edf	884.931763	hearts=50 junctions=47	3000	keep	hub approach + deposit side rotation - 8 cogs seed 42 (+12.1% vs baseline)
8b9765b	718.524536	hearts=37 junctions=?	3000	discard	deposit patience 1.5x - regression. reverted
e68cff7	629.296814	hearts=35 junctions=?	3000	discard	return_load=30 - regression. travel time too costly
abc9b35	893.716492	hearts=52 junctions=?	3000	keep	faster deposit side rotation (15-step stale) - 8 cogs seed 42 (+1.0% vs prev best)
abc9b35	651.014954	hearts=39 junctions=?	3000	keep	faster deposit side rotation - 8 cogs seed 123 (+14.8% vs baseline)
abc9b35	37.424042	hearts=20 junctions=?	500	keep	faster deposit side rotation - 8 cogs seed 42 (+9.2% vs baseline)
aa4c204	913.133484	hearts=52 junctions=?	3000	keep	junction align distance 15→20 - 8 cogs seed 42 (+2.2% vs prev best)
aa4c204	772.552185	hearts=48 junctions=?	3000	keep	junction align distance 15→20 - 8 cogs seed 123 (+18.7% vs prev)
aa4c204	40.536003	hearts=? junctions=?	500	keep	junction align distance 15→20 - 8 cogs seed 42 (+8.3% vs prev)
