commit	mission_reward	secondary_rewards	steps	status	description
tc_longep3k_e65	1.214667	aligned.junction.held=~9500	10000	discard	tc_longep3k e65 @10K (3-ep, peak=1.414) - anomalous recovery
longep3k_e25_v2	1.060500	aligned.junction.held=~5000	10000	discard	longep3k e25 @10K (3-ep, peak=1.115) - confirmed sharp drop from e20
longep3k_e30_v2	1.153133	aligned.junction.held=~8000	10000	discard	longep3k e30 @10K (3-ep, peak=1.303) - brief recovery
longep3k_e35_v2	1.051900	aligned.junction.held=~4000	10000	discard	longep3k e35 @10K (3-ep, peak=1.084) - declining
longep3k_e40_v2	1.107967	aligned.junction.held=~8000	10000	discard	longep3k e40 @10K (3-ep, peak=1.249) - fluctuating
longep3k_e45	1.032833	aligned.junction.held=~3000	10000	discard	longep3k e45 @10K (3-ep, peak=1.099) - near baseline
longep3k_e50	1.022100	aligned.junction.held=~2000	10000	discard	longep3k e50 @10K (3-ep, peak=1.066) - effectively dead
slowent_e5	1.019500	aligned.junction.held=~1500	10000	discard	Slow entropy e5 @10K (3-ep) - too early, warming up
from_tc80_e5	1.017100	aligned.junction.held=~1300	10000	discard	From tc80 e5 @10K (3-ep) - too early, warming up
finetune_e10	1.294633	aligned.junction.held=~12000	10000	keep	Fine-tune from longep3k_e20 LR=0.0005 e10 @10K (3-ep, peak=1.643, std=0.258) - 2nd best
finetune_v2_e15	1.132867	aligned.junction.held=~8000	10000	discard	Finetune v2 (from ft_e10) e15 @10K (3-ep) - declining from e10
longep4k_e25	1.065500	aligned.junction.held=~5000	10000	discard	4000-step episodes e25 @10K (3-ep) - worse than 3000-step
bptt128_e10	1.094700	aligned.junction.held=~7000	10000	discard	BPTT128+GAE0.95 e10 @10K (3-ep) - not competitive
seed123_e10	1.286267	aligned.junction.held=~10000	10000	discard	Seed123 repro test e10 @10K (3-ep, peak=1.673, std=0.274) - high variance
seed123_e35	1.072000	aligned.junction.held=~5000	10000	discard	Seed123 e35 @10K (5-ep, peak=1.156, std=0.049) - seed dependent ceiling ~1.07
seed123_e40	1.065000	aligned.junction.held=~5000	10000	discard	Seed123 e40 @10K (5-ep, peak=1.162, std=0.070) - confirms seed123 plateaus low
seed123_e45	1.023000	aligned.junction.held=~3000	10000	discard	Seed123 e45 @10K (5-ep, peak=1.117, std=0.047) - declining
m2x10_e10	1.023567	aligned.junction.held=~2000	10000	discard	milestones_2:10 e10 @10K (3-ep) - compounding factor 10 too aggressive
m2x10_e15	1.062800	aligned.junction.held=~4000	10000	discard	milestones_2:10 e15 @10K (3-ep) - slightly better than baseline
m2x10_e20	1.102600	aligned.junction.held=~7000	10000	discard	milestones_2:10 e20 @10K (5-ep, peak=1.339, std=0.125) - worse than default m2:5
aligner_m2x10_e25	1.030300	aligned.junction.held=~2000	10000	discard	aligner+milestones_2:10 e25 @10K (1-ep) - aligner variant fails, gear penalty disrupts
seed7_e10	1.105300	aligned.junction.held=~7000	10000	discard	seed=7 e10 @10K (1-ep) - brief spike, not sustained
seed7_e15	1.075900	aligned.junction.held=~5000	10000	discard	seed=7 e15 @10K (1-ep) - declining
seed7_e20	1.000000	aligned.junction.held=~0	10000	discard	seed=7 e20 @10K (1-ep) - collapsed to baseline
seed7_e25-e40	1.000000	aligned.junction.held=~0	10000	discard	seed=7 e25-e40 all at baseline - another failed seed
map42_seed7_e20	1.283140	aligned.junction.held=~10000	10000	keep	map_seed=42+seed=7 e20 @10K (5-ep, peak=1.601, std=0.205) - confirms map_seed matters
map42_seed7_e25	1.088500	aligned.junction.held=~6000	10000	discard	map42+seed7 e25 @10K (1-ep) - declining from e20 peak
map42_seed7_e30	1.122000	aligned.junction.held=~7000	10000	discard	map42+seed7 e30 @10K (1-ep) - oscillating
map42_seed123_e15	1.054200	aligned.junction.held=~3000	10000	discard	map42+seed123 e15 @10K (1-ep) - slow learner
map42_seed123_e30	1.196667	aligned.junction.held=~9000	10000	keep	map42+seed123 e30 @10K (3-ep, peak=1.384, std=0.145) - learns late
p3v2_e5	1.136940	aligned.junction.held=~8000	10000	keep	P3 max_dist=15 from longep3k_e20 @10K (5-ep, peak=1.257, std=0.115)
p3v2_e20	1.166160	aligned.junction.held=~8000	10000	keep	P3 e20 @10K (5-ep, peak=1.327, std=0.108) - best P3 so far
map42_seed13_e15	1.165420	aligned.junction.held=~8000	10000	discard	map42+seed13 e15 @10K (5-ep, peak=1.338, std=0.125) - population test
map42_seed13_e10	1.100900	aligned.junction.held=~7000	10000	discard	map42+seed13 e10 @10K (3-ep, peak=1.219)
map42_seed31_e30	1.140500	aligned.junction.held=~8000	10000	discard	map42+seed31 e30 @10K (1-ep) - slow learner
temp05_longep3k_e20	1.252929	aligned.junction.held=~10000	10000	discard	longep3k_e20 temp=0.5 @10K (7-ep, peak=1.483) - temp=0.7 still best
temp06_longep3k_e20	1.187240	aligned.junction.held=~8000	10000	discard	longep3k_e20 temp=0.6 @10K (5-ep) - worse than 0.7
p3_from_map42s7_e5	1.172167	aligned.junction.held=~8000	10000	discard	P3 from map42_seed7_e20 e5 @10K (3-ep, peak=1.512, std=0.240)
p3_from_map42s7_e10	1.243200	aligned.junction.held=~9000	10000	keep	P3 from map42_seed7_e20 e10 @10K (3-ep, peak=1.553, std=0.231) - improving
swa_top3	1.298020	aligned.junction.held=~10000	10000	discard	SWA avg of 3 models @10K (5-ep, peak=1.415, std=0.091) - lower variance but lower avg than base
swa_top2	1.127920	aligned.junction.held=~7000	10000	discard	SWA avg of 2 models @10K (5-ep, peak=1.226, std=0.066) - too conservative
swa_base_ft_60_40	1.139260	aligned.junction.held=~8000	10000	discard	60/40 blend longep3k_e20+finetune_e10 @10K (5-ep, peak=1.288, std=0.126) - weight averaging hurts
constlr_e5	1.013967	aligned.junction.held=~500	10000	discard	Constant LR from p2_longrun e5 @10K (3-ep, peak=1.025) - still learning
constlr_e10	1.076900	aligned.junction.held=~5000	10000	discard	Constant LR from p2_longrun e10 @10K (3-ep, peak=1.216) - improving
finetune_e5	1.253167	aligned.junction.held=~10000	10000	keep	Finetune from longep3k_e20 LR=0.0005 e5 @10K (3-ep, peak=1.311, std=0.050)
finetune_e15	1.031500	aligned.junction.held=~3000	10000	discard	Finetune e15 @10K (3-ep, peak=1.062) - sharp decline from e10
ft_constlr_e5	1.178500	aligned.junction.held=~8000	10000	discard	Constant LR fine-tune from longep3k_e20 LR=0.0003 e5 @10K (3-ep, peak=1.445, std=0.192)
ft_constlr_e10	1.143520	aligned.junction.held=~8000	10000	discard	Constant LR fine-tune e10 @10K (5-ep validated, peak=1.403, std=0.149) - 3-ep was 1.612 outlier
ft_constlr_e15	1.129067	aligned.junction.held=~7000	10000	discard	Constant LR fine-tune e15 @10K (3-ep, peak=1.262, std=0.097)
ft_constlr_e20	1.015733	aligned.junction.held=~500	10000	discard	Constant LR fine-tune e20 @10K (3-ep, peak=1.040) - collapsed
ft_constlr_e25	1.105800	aligned.junction.held=~6000	10000	discard	Constant LR fine-tune e25 @10K (3-ep, peak=1.206, std=0.072)
ft_constlr_e30	1.007767	aligned.junction.held=~500	10000	discard	Constant LR fine-tune e30 @10K (3-ep, peak=1.013) - collapsed
ft_constlr_e35	1.043133	aligned.junction.held=~2000	10000	discard	Constant LR fine-tune e35 @10K (3-ep, peak=1.106, std=0.046)
ft_constlr_e5_5ep	1.072580	aligned.junction.held=~5000	10000	discard	Constant LR fine-tune e5 @10K (5-ep validated, peak=1.210, std=0.078)
finetune_e20	1.000000	aligned.junction.held=~0	10000	discard	Finetune from longep3k_e20 LR=0.0005 e20 @10K (3-ep) - completely collapsed
finetune_e25	1.042833	aligned.junction.held=~2000	10000	discard	Finetune e25 @10K (3-ep, peak=1.129) - near dead
finetune_e30	1.051533	aligned.junction.held=~3000	10000	discard	Finetune e30 @10K (3-ep, peak=1.155) - near dead
higamma_e5	1.000000	aligned.junction.held=~0	10000	discard	High gamma (0.998) e5 @10K (3-ep) - still learning
higamma_e10	1.282867	aligned.junction.held=~8000	10000	keep	High gamma (0.998) e10 @10K (3-ep, peak=1.849, std=0.400) - promising, needs more epochs
bptt128_old_e5	1.036700	aligned.junction.held=~1000	10000	discard	Old bptt128 from prev session e5 @10K (3-ep, peak=1.072)
bptt128_old_e10	1.003433	aligned.junction.held=~0	10000	discard	Old bptt128 from prev session e10 @10K (3-ep) - collapsed
