commit	mission_reward	secondary_rewards	steps	status	description
4531257	41.850000	online_rank=#5	10000	keep	baseline: evyIm-73a-stuck15 online score (132 comp matches)
14f5686	0.000000	cannot_test_offline	0	discard	toEqP integration: HUB=30, 5A+3M, spread, enemy — ALL proven to hurt online
f26807b	0.000000	cannot_test_offline	0	discard	early-game heart dispatch — reverted, similar to patience=10 which hurt online
f693106	0.000000	cannot_test_offline	0	keep	contamination avoidance: track gear-switch cells, avoid in BFS
98e69b8	41.850000	structural_only	10000	keep	reverted parameter changes, kept structural improvements
d186121	0.000000	cannot_test_offline	0	keep	distance-aware retreat + phase-aware defense + step counter
faa6433	0.000000	bug_fix	0	keep	fix: progress tracking was always False for get_heart/align_neutral
e76016b	0.000000	bug_fix	0	keep	fix: same progress tracking bug in cross_role_policy.py
002e564	0.000000	bug_fix	0	keep	fix: _bfs_without_cooldowns corrupting SharedMap via in-place set mutation
99e9677	0.000000	bug_fix	0	keep	fix: junction blacklist removing targets from SharedMap, hiding from all agents
6ffee00	0.000000	structural_only	0	keep	defend patrol: cycle between junctions instead of sitting idle
b1f88b9	0.000000	structural_only	0	keep	defend navigation: prefer hazard-avoiding paths
3925e4d	0.000000	bug_fix	0	keep	fix: HP retreat oscillation — recovery threshold was same as retreat
fdcf930	0.000000	critical_bug_fix	0	keep	fix: HP retreat was completely dead — _read_hp returned None
85cffcd	0.000000	structural_only	0	keep	improve: _move_to uses full BFS fallback chain for exploration
88a8a64	0.000000	bug_fix	0	keep	fix: contamination false positive on death + defend/retreat navigation for junctions
f3b411d	0.000000	structural_only	0	keep	fix: retreat stuck detection — cancel retreat after 50 stuck steps
88a8a64	0.000000	bug_fix	0	keep	fix: contamination false positive on death + defend/retreat navigation for junctions
02e8ecf	0.000000	structural_only	0	keep	improve: collect hearts during HP retreat when near hub
0e6f90d	0.000000	bug_fix	0	keep	fix: cap miner max_hp_seen at base HP to prevent permanent retreat
d465237	0.000000	bug_fix	0	keep	fix: base miner max_hp_seen cap + periodic blacklist expiry
d3d0530	0.000000	structural_only	0	keep	improve: defend exits early when miners craft new hearts
a179d78	0.000000	bug_fix	0	keep	fix: abort get_heart/align_neutral immediately on aligner gear loss
3d133f0	0.000000	bug_fix	0	keep	fix: cancel current skill on HP retreat start and recovery
6df3b52	0.000000	bug_fix	0	keep	fix: miner junction tracking fails to detect friendly→neutral flips
18d4b8d	0.000000	bug_fix	0	keep	fix: defend patrol precedence + miner HP retreat skill cancellation
3008f37	0.000000	bug_fix	0	keep	fix: gear_up ignores shared aligner station knowledge from team
045a8aa	0.000000	bug_fix	0	keep	fix: deposit tracking counts cargo lost on death as deposits
c80aabd	0.000000	structural_only	0	keep	improve: defend patrol prioritizes junctions near enemy territory
473fd86	0.000000	bug_fix	0	keep	fix: _JUNCTION_ALIGN_DISTANCE 25→15 to match game engine cascade range
e58e5b8	0.000000	structural_only	0	keep	improve: cascade priority scoring considers junction unlock potential
1c57455	0.000000	structural_only	0	keep	improve: align_neutral BFS fallback adds without-cooldowns+no-hazard-avoid
dfae4c1	0.000000	bug_fix	0	keep	fix: aligner removes own stations from shared hazard set
33b33e6	0.000000	bug_fix	0	keep	fix: miner removes own stations from shared hazard set
d77c2a5	0.000000	structural_only	0	keep	improve: miner hub tethering prevents distant deaths and cargo loss
0e5c771	0.000000	structural_only	0	keep	improve: aligner hub tether + enemy recapture priority + contamination cap
f4c17b3	0.000000	structural_only	0	keep	improve: lower team scarce element threshold 5→3 for faster heart production
ce85c3c	0.000000	bug_fix	0	keep	fix: share depleted_extractors via SharedMap to prevent duplicate mining
162414c	0.000000	structural_only	0	keep	improve: goal-directed BFS expansion for miner navigation
d41eb40	0.000000	structural_only	0	keep	improve: miners deposit at nearest friendly junction when closer than hub
5cd0954	0.000000	bug_fix	0	keep	fix: miner death false deposits + aligner contamination cell expiry
785ff9b	0.000000	structural_only	0	keep	improve: distance-based aligner target yielding instead of blanket blacklist
5150e3b	0.000000	structural_only	0	keep	improve: heartless defenders exit sooner (stuck*4) to get hearts for recapture
dfd0e4a	0.000000	structural_only	0	keep	improve: miner extractor selection considers junction deposit proximity
a0077ea	0.000000	structural_only	0	keep	improve: heartless defenders react to enemy junctions + single-junction explore
93ab1cc	0.000000	structural_only	0	keep	improve: territory-aware aligner tether + multi-enemy defend scoring
2828173	0.000000	bug_fix	0	keep	fix: heart withdrawal overcount + faster blacklist expiry + earlier defense
b567a03	0.000000	structural_only	0	keep	improve: early heart grab — aligners collect hearts before gear-up
658a621	0.000000	structural_only	0	keep	improve: cascade priority considers friendly junction clustering
36a5f52	0.000000	structural_only	0	keep	improve: dynamic heart accumulation based on alignable junction count
1a40daa	0.000000	structural_only	0	keep	improve: adaptive defend patrol — faster cycling under enemy threat
111df1e	0.000000	structural_only	0	keep	improve: explore exits when territory expansion reveals alignable junctions
a76ca6b	0.000000	structural_only	0	keep	improve: spread-aware explore — aligners avoid exploring same direction
559111f	0.000000	bug_fix	0	keep	fix: distance-aware HP retreat + retreat-by-alignment for agent lifespan
c336090	0.000000	structural_only	0	keep	improve: smarter heart queue — redirect excess aligners to defend
3df0170	0.000000	structural_only	0	keep	improve: defend stability — distance check for exit + longer patrol
c9e9671	0.000000	bug_fix	0	keep	fix: agent_gears never populated + spread-aware miner explore
863ca96	0.000000	bug_fix	0	keep	fix: miner _move_to missing optimistic BFS fallback
c120dee	0.000000	bug_fix	0	keep	fix: miner move tracking on HP retreat and hub tether paths
33f4ab9	0.000000	bug_fix	0	keep	fix: aligner move tracking on all early return paths
de4e34f	0.000000	critical_bug_fix	0	keep	fix: aligners navigate to enemy junctions they can't align + heart-before-gear on respawn
048d496	0.000000	bug_fix	0	keep	fix: cleanup stale enemy junction references after alignment target fix
b6235b8	0.000000	critical_bug_fix	0	keep	fix: cross_role_policy same enemy junction alignment bug
de82ebe	0.000000	bug_fix	0	keep	fix: visual extractor depletion — remove stale extractors immediately
2220539	0.000000	bug_fix	0	keep	fix: depleted extractors not subtracted in fast-path skill selection
2991329	0.000000	bug_fix	0	keep	fix: cross_role stale extractor removal missing depleted tracking
0831642	0.000000	bug_fix	0	keep	fix: stationary_on_valid_target counts depleted extractors as valid
e3e8a4f	0.000000	bug_fix	0	keep	fix: all skill selection paths use active extractors instead of raw known
437869e	0.000000	bug_fix	0	keep	fix: cross_role deposit tracking counts cargo lost on death as deposits
2dcd252	0.000000	critical_bug_fix	0	keep	fix: CrossRoleState missing 6 fields — agents returned noop every step
432ec5d	0.000000	bug_fix	0	keep	fix: junction deposit navigation missing BFS fallback chain
900d7c6	0.000000	bug_fix	0	keep	fix: cross_role double movement tracking + retreat to friendly junctions
b7b8ca3	0.000000	bug_fix	0	keep	fix: heart accumulation progress tracking only detected first heart
400a3ff	0.000000	bug_fix	0	keep	fix: heart queue missing 3 hearts from initial hub elements (24//7=3)
1176415	0.000000	bug_fix	0	keep	fix: cross_role hub_hearts_withdrawn always +1 instead of actual count
c3ad361	0.000000	structural_only	0	keep	improve: cascade-aware defend scoring + cross_role alignable range check
a5bca44	0.000000	structural_only	0	keep	improve: cross_role heart accumulation near hub before departing
e9c2aef	0.000000	bug_fix	0	keep	fix: cross_role get_heart_timeouts never gates skill selection
7ea1e75	0.000000	bug_fix	0	keep	fix: cross_role SharedMap stale gear + heart queue tracking between replans
de209da	0.000000	bug_fix	0	keep	fix: cross_role missing gear-loss skill abort — wastes 15 steps after contamination
c866809	0.000000	bug_fix	0	keep	fix: cascade priority double-counts enemy junctions in unlocks + recapture
b036cf7	0.000000	structural_only	0	keep	improve: cross_role defend patrol cycling between friendly junctions
77feddc	0.000000	structural_only	0	keep	improve: spread-aware explore in base aligner — avoids teammate clustering
e02f947	0.000000	structural_only	0	keep	improve: miner _explore_near_hub spread awareness — avoid miner clustering
39e881e	0.000000	bug_fix	0	keep	fix: cross_role fast-path bypasses get_heart_timeouts defend redirect
a1fe6d0	0.000000	structural_only	0	keep	improve: cross_role heart queue defend + phase-aware late-game defense
7b9e842	0.000000	structural_only	0	keep	improve: cross_role retreat-by-alignment — align nearby junctions during HP retreat
ac4853d	0.000000	structural_only	0	keep	improve: cross_role retreat cooldown clearing at 50 steps before giving up at 100
408e781	0.000000	structural_only	0	keep	improve: cross_role aligner tether measures distance to nearest friendly anchor
752b29b	0.000000	structural_only	0	keep	improve: cross_role smarter defend exits — enemy recapture, new hearts, gear loss
e192fc6	0.000000	critical_bug_fix	0	keep	fix: cross_role contamination cell tracking was completely dead
74e65f1	0.000000	bug_fix	0	keep	fix: cross_role deposit_to_hub valid target missing junction proximity
2820d33	0.000000	bug_fix	0	keep	fix: miner deposit_to_hub valid target missing junction proximity
55ac65a	0.000000	bug_fix	0	keep	fix: cross_role miner gear-loss doesn't record contamination cell
ce5d222	0.000000	structural_only	0	keep	improve: cross_role explore time cap at stuck_threshold*2 steps
05591bf	0.000000	structural_only	0	keep	improve: cross_role heart-before-gear — grab hearts near hub before aligner gear-up
7ad9c55	0.000000	critical_bug_fix	0	keep	fix: defend heart-acquisition exit was dead code in both machina + cross_role
fa4cdb9	0.000000	bug_fix	0	keep	fix: cross_role get_heart exits don't clear agents_getting_hearts queue
7bbdc77	0.000000	bug_fix	0	keep	fix: explore completion counts decrease on teammate align/deplete — all 3 policies
76d159c	0.000000	bug_fix	0	keep	fix: explore_start counters not initialized on fast-path/tether skill assignment
7b8c105	0.000000	bug_fix	0	keep	fix: _in_friendly_territory same distance for hub+junction — false safe at dist 11-15 from junction
e4b0992	0.000000	structural_only	0	keep	improve: miner extractor target coordination via SharedMap — yield to closer miners
03a1168	0.000000	structural_only	0	keep	cleanup: remove dead code — _expand_hazard_zone + unused extractor-to-hub functions
c36df8a	0.000000	bug_fix	0	keep	fix: tether get_heart missing start_count + cross_role defend missing alignable exit
625e45c	0.000000	bug_fix	0	keep	fix: cross_role junction deposit BFS skipped hazard avoidance
ce4863e	0.000000	bug_fix	0	keep	fix: retreat navigation skips hazard avoidance — causes gear contamination
07bab6f	0.000000	bug_fix	0	keep	fix: cross_role retreat/tether greedy fallback ignores hazard stations
9957291	0.000000	bug_fix	0	keep	fix: defend heart-acquisition exits don't reset get_heart_timeouts
1e738fa	0.000000	bug_fix	0	keep	fix: cross_role defend noop at dist<=2 + defend greedy missing hazard avoidance
df68760	0.000000	critical_bug_fix	0	keep	fix: machina defend exits as stale after 15 steps — missing defend exclusion
82ad5c9	0.000000	structural_only	0	keep	improve: cross_role direct BFS for junction navigation — defend, retreat, retreat-by-alignment
2e97755	0.000000	bug_fix	0	keep	fix: machina retreat-by-alignment uses _navigate_to_station for walkable junctions
e5bc1cd	0.000000	bug_fix	0	keep	fix: _navigate_to_station greedy fallback ignores hazard stations
4078aed	0.000000	wrong_fix	0	discard	REVERTED: junction deposits DO transfer to hub via queryDeposit — fix was incorrect
b6f692e	0.000000	bug_fix	0	keep	fix: aligner tether navigation — missing hazard fallback + _move_to on blocked hub
2b3743b	0.000000	bug_fix	0	keep	fix: aligner yield coordination yields to agents with unknown position
1137195	0.000000	bug_fix	0	keep	fix: cross_role aligner yield coordination same unknown position bug
7967f3a	0.000000	bug_fix	0	keep	fix: machina stale agent_gears after death — gearless agents retain pre-death gear
2c76042	0.000000	bug_fix	0	keep	fix: miner stale agent_gears after death — same bug as aligner
4915278	0.000000	bug_fix	0	keep	fix: cross_role tether + gear_up_via_hub missing hazard fallback for hub navigation
26cc4e2	0.000000	bug_fix	0	keep	fix: cross_role retreat hub approach at dist=2 missing hazard fallback
6643bc6	0.000000	structural_only	0	keep	cleanup: remove dead defend_last_junction field from both policies
400b88b	0.000000	bug_fix	0	keep	fix: miner hub tether calls deposit_to_hub with zero cargo — oscillation
0a1ef42	0.000000	bug_fix	0	keep	fix: cross_role miner hub tether navigates to hub with zero cargo
39f62ad	0.000000	bug_fix	0	keep	fix: aligner yield uses <= causing both equidistant aligners to yield
90445c6	0.000000	bug_fix	0	keep	fix: machina + cross_role miners missing extractor depletion detection
10424bf	0.000000	bug_fix	0	keep	fix: CrossRoleState missing steps_near_extractor_no_gain field
ff3010f	0.000000	critical_bug_fix	0	keep	fix: cross_role hub_hearts_withdrawn overcounts by 1 on every get_heart exit
cf67283	0.000000	critical_bug_fix	0	keep	fix: cross_role get_heart_cooldown_steps never activated — dead code
5e90262	0.000000	critical_bug_fix	0	keep	fix: extractor depletion check always true — last_carried_total updated before comparison
c412a05	0.000000	bug_fix	0	keep	fix: machina get_heart stuck/stale exits don't increment get_heart_timeouts
a66429f	0.000000	bug_fix	0	keep	fix: cross_role get_heart stuck/stale exits don't increment get_heart_timeouts
9a540ab	0.000000	bug_fix	0	keep	fix: _clear_shared_map_tracking missing miner_targets cleanup
df21603	0.000000	bug_fix	0	keep	fix: cross_role _update_map_memory drops move_blocked_cells and cooldown_cells
