commit	mission_reward	secondary_rewards	steps	status	description
dd20aba	0.495000	junction.held=avg seeds42-47 (0.521,0.366,0.358,0.639,0.487,0.596)	1000	keep	machina_llm_roles 4A4M scripted fast-fail seeds 42-47 avg - BASELINE
9da719f	0.372000	junction.held=avg seeds42-47 (46=0.10,47=0.17 catastrophic)	1000	discard	cross_role scripted_miners 4A4M fast-fail seeds 42-47 avg - aligners fail seeds 46/47
dd20aba	0.540000	junction.held=avg seeds42-47 (0.564,0.543,0.337,0.614,0.565,0.614)	1000	keep	machina_llm_roles 5A3M scripted fast-fail seeds 42-47 avg - +9% over 4A4M baseline
dd20aba	0.467000	junction.held=avg seeds42-47 (0.453,0.591,0.430,0.294,0.607,0.429)	1000	discard	machina_llm_roles 6A2M scripted fast-fail seeds 42-47 avg - worse than 4A4M
dd20aba	0.450000	junction.held=avg seeds42-47 (0.450,0.484,0.368,0.520,0.518,0.362)	1000	discard	machina_llm_roles 3A5M scripted fast-fail seeds 42-47 avg - worse than 4A4M
dd20aba	0.549000	junction.held=avg seeds42-47 (0.559,0.653,0.337,0.518,0.635,0.590)	1000	discard	machina_llm_roles 5A1S2M return_load=20 fast-fail seeds 42-47 avg - scout still dying
dd20aba	0.634000	junction.held=avg seeds42-47 (0.475,0.685,0.761,0.511,0.699,0.673)	1000	keep	machina_llm_roles 4A0S4M no-scout return_load=20 fast-fail - HUGE +28% improvement!
0042a1e	0.645000	junction.held=avg seeds42-47 (0.475,0.685,0.761,0.511,0.699,0.740)	1000	keep	deposit_to_hub timeout extended to 200 steps (was 100) - seed 47 +10%
af3b8a9	0.663000	junction.held=avg seeds42-47 (0.475,0.685,0.761,0.511,0.699,0.849)	1000	keep	deposit_to_hub timeout loop fix: detect timeout in scripted choice, seed 47 +15%
0d35166	0.675000	junction.held=avg seeds42-47 (0.475,0.685,0.761,0.580,0.699,0.849)	1000	keep	deposit stale fix: explore when full-cargo+stale, add explore timeout 100s - seeds 45+47 both improved
5329e28	0.583000	seeds42-47 (0.61,0.46,0.49,0.50,0.59,0.85)	1000	discard	fix-miner-heart-theft: actorHas(aligner) filter on get_heart - contaminated aligners cant get hearts
5af16e9	0.507000	seeds42-47 (0.51,0.39,0.34,0.51,0.65,0.64)	1000	discard	primary-element-mining: per-miner element assignment - strict specialization hurts seeds 43/44/47
b117951	0.507000	seeds42-47 (0.57,0.55,0.60,0.63,0.75,0.50)	1000	discard	hub-aware-mining threshold=7: balanced deposit tracking - seed 47 drops 0.849->0.50 due to overriding routes
b117951	0.643000	seeds42-47 (0.57,0.64,0.73,0.58,0.70,0.60)	1000	discard	hub-aware-mining threshold=21: seed 47 still drops 0.849->0.60 - redirecting miners too aggressive
b117951	0.632	seeds42-47 (0.77,0.74,0.42,0.59,0.66,0.61)	1000	discard	junction-reservation: prevent aligners targeting same junction - helps seed42+43 but hurts seed44+47 consistently
b117951	0.585	seeds42-47 (0.57,0.66,0.35,0.59,0.63,0.71)	1000	keep	TRUE BASELINE re-measured: machina_llm_roles 4A0S4M llm_timeout=0.001 scripted_miners (TSV rows 8-11 used different measurement)
2c5efb6	0.632	seeds42-47 (0.77,0.74,0.42,0.59,0.66,0.61)	1000	keep	junction-reservation: soft reservation in SharedMap +8% over true baseline
2c5efb6	0.587	seeds42-47 (0.61,0.74,0.34,0.59,0.63,0.61)	1000	discard	distance-proportional-reservation: 1.5x distance threshold collapses seed42 back - simple reservation is better
0f714c6	0.587	seeds42-47 (0.55,0.72,0.34,0.59,0.63,0.65)	1000	discard	distance-proportional-reservation 2x: same pattern, seed42 collapses - hard reservation is best form
0f714c6	0.598	seeds42-47 (0.59,0.80,0.43,0.55,0.63,0.59)	1000	discard	HP-retreat-fix: fix _read_hp to use inv:hp prefix - seed42 drops 0.77->0.59 miners retreat too early
0f714c6	0.478	seeds42-47 (0.45,0.49,0.38,0.49,0.53,0.57)	1000	discard	5A0S3M-with-reservation: 5 aligners 3 miners - too few miners hurts overall
0f714c6	0.515	seeds42-47 (0.44,0.58,0.38,0.52,0.52,0.62)	1000	discard	3A0S5M-with-reservation: 3 aligners 5 miners - too few aligners hurts junction coverage
0f714c6	0.557	seeds42-47 (0.53,0.72,0.38,0.55,0.63,0.56)	1000	discard	return_load=10: miners return too frequently, reduces mining efficiency
0f714c6	0.567	seeds42-47 (0.56,0.73,0.37,0.56,0.63,0.58)	1000	discard	return_load=15: slightly better than 10 but still worse than default 20
b7ffd23	0.586	seeds42-47 (0.60,0.57,0.52,0.58,0.63,0.63)	1000	discard	miner-extractor-reservation: spread miners across extractors - breaks nearest-first heuristic seeds 42+43 drop
4c94cd2	0.667	seeds42-47 (0.65,0.70,0.75,0.73,0.63,0.54)	1000	keep	shared-element-extractors: team-wide scarce-element routing +5.5% over junction-reservation - seed44 +79%!
33bf3db	0.663	seeds42-47 (0.57,0.70,0.75,0.73,0.63,0.60)	1000	discard	scarce-element-distance-cap-30: seed42 collapses when cap prevents cross-map carbon routing
33f6f08	0.677	seeds42-47 (0.65,0.70,0.75,0.73,0.63,0.60)	1000	keep	scarce-element-distance-cap-40: new best! seed47 improves 0.54->0.60 without hurting seed42
3992a45	0.700	seeds42-47 (0.82,0.60,0.65,0.74,0.63,0.76) fresh re-run	1000	keep	FRESH BASELINE at HEAD: re-ran all seeds after session restart - 0.700 avg (higher than prior 0.677 recording)
081ab86	0.668	seeds42-47 (0.66,0.60,0.83,0.73,0.63,0.56)	1000	discard	expanded-alignment-reach: HUB_ALIGN 25->35 JUNCTION_ALIGN 15->20 - seed44 +28% but seed42 -19% seed47 -26%
7e8a9f3	0.652	seeds42-47 (0.67,0.58,0.74,0.73,0.63,0.56)	1000	discard	intermediate-alignment-reach: HUB_ALIGN=30 JUNCTION_ALIGN=18 - still hurts seeds 42/47 systematically
c6b527a	0.712	seeds42-47 (0.82,0.67,0.65,0.74,0.63,0.76)	1000	keep	scarce-threshold-3: lower threshold 5->3 for scarce routing - seed43 +12% (0.60->0.67) NEW BEST!
1859e89	0.723	seeds42-47 (0.82,0.74,0.65,0.74,0.63,0.76)	1000	keep	scarce-cap-50: increase distance cap 40->50 tiles - seed43 +10% (0.67->0.74) NEW BEST!
eb402e9	0.735	seeds42-47 (0.82,0.81,0.65,0.74,0.63,0.76)	1000	keep	scarce-cap-45: cap=45 tiles - seed43 jumps 0.67->0.81 (+21%) NEW BEST!
1859e89_b	0.723	seeds42-47 (0.82,0.74,0.65,0.74,0.63,0.76)	1000	discard	scarce-cap-55: cap=55 tiles - seed43 drops back to 0.74, 45 is goldilocks
1859e89_c	0.723	seeds42-47 (0.82,0.74,0.65,0.74,0.63,0.76)	1000	discard	scarce-cap-60: same as 55 - confirmed 45 is goldilocks for seed43
3992a45_re	0.735	seeds42-47 (0.82,0.81,0.65,0.74,0.63,0.76)	1000	keep	TRUE BASELINE re-measured at session 8 start - fresh re-run confirms 0.735 avg
c21d6ff	0.762	seeds42-47 (0.68,0.86,0.98,0.74,0.63,0.68)	1000	keep	team-deposit-empty-inv: route empty-inventory miners to team-scarce element - seed44 +51%! NEW BEST!
64f1882	0.772	seeds42-47 (0.68,0.86,0.98,0.74,0.63,0.74)	1000	keep	team-scarce-limit-100: 100-step time limit prevents stuck loops - seed47 +9% (0.68->0.74) NEW BEST!
80a1171	0.715	seeds42-47 (0.69,0.86,0.82,0.74,0.63,0.55)	1000	discard	min-element-deposits-5: require deposits[element]>=5 before classifying scarce - seed44/47 hurt
96ad450	0.760	seeds42-47 (0.68,0.86,0.98,0.74,0.63,0.67)	1000	discard	stationary-detection-5: 5-step stationary limit in team-scarce routing - seed47 drops 0.74->0.67
1f7c6d9	0.713	seeds42-47 (0.68,0.86,0.82,0.74,0.63,0.55)	1000	discard	total-deposits-40: require total>=40 before team-scarce routing - seed44/47 hurt same pattern
26d5240	0.767	seeds42-47 (0.82,0.81,0.84,0.74,0.63,0.76)	1000	discard	proximity-margin=0: seed42 fixed 0.68->0.82 but seed44 drops 0.98->0.84 (too strict)
5d70c80	0.790	seeds42-47 (0.77,0.86,0.98,0.74,0.63,0.76)	1000	keep	proximity-margin=10: GOLDILOCKS seed42 0.68->0.77 AND seed44 preserved at 0.98 - NEW BEST!
a0fc8dd	0.790	seeds42-47 (same 0.790 avg)	1000	discard	parallel-limited team-scarce (max 2 miners): no change - routing already only 1-2 miners at a time
4f9445e	0.363	seeds42-47 (0.10,0.59,0.36,0.55,0.19,0.39)	1000	discard	clear-move-blocked-cells (all visible non-wall cells): catastrophic - move_blocked_cells needed for nav
4dc728c	0.505	seeds42-47 (0.61,0.51,0.36,0.44,0.45,0.66)	1000	discard	clear-agent-blocked-cells (only passable cells): still catastrophic - move_blocked_cells critical
6248747	0.595	seeds42-47 (0.51,0.50,0.43,0.69,0.62,0.82)	1000	discard	hub-slot-reservation for aligners: aligners redirect to explore when hub taken - catastrophic (aligners can't get hearts)
c1296c2	0.695	seeds42-47 (0.73,0.85,0.67,0.58,0.63,0.71)	1000	discard	per-miner-scarce-proximity margin=10: prevents per-miner balance routing - seed44 drops 0.98->0.67
38a98cf	0.790	seeds42-47 (same 0.790 avg)	1000	discard	short-explore-after-deposit-timeout: 20-step explore when hub known after timeout - no change
79f9352	0.783	seeds42-47 (0.77,0.82,0.98,0.74,0.63,0.76)	1000	discard	longer-mine-timeout 8x: seed43 drops 0.86->0.82 - longer mining hurts not helps
5d70c80	0.790	seeds42-47 (same 0.790 avg)	1000	discard	enemy-avoiding junction selection: prefer junctions far from enemy territory - no change
5d70c80	0.545	seeds42-47 (0.41,0.48,0.60,0.65,0.63,0.50)	1000	discard	staggered return_load 40/45/50/55: higher loads destroy mining efficiency
5d70c80	0.675	seeds42-47 (0.61,0.64,0.95,0.65,0.63,0.57)	1000	discard	patient hub waiting: double stuck threshold for get_heart - cascade blocking hurts
5d70c80	0.562	seeds42-47 (0.81,0.30,0.77,0.44,0.57,0.48)	1000	discard	explore-first aligner: delay get_heart until first junction found - seed43 catastrophic drop
5d70c80	0.680	seeds42-47 (0.67,0.86,0.78,0.74,0.63,0.71)	1000	discard	stale extractor removal from element caches: seed44 drops 0.98->0.78 seed47 drops 0.76->0.71
5d70c80	0.735	seeds42-47 (ratio=1.5 seed44=0.65)	1000	discard	ratio-based proximity 1.5x: seed44 drops badly vs margin=10
5d70c80	0.755	seeds42-47 (ratio=2.0 seed44=0.85)	1000	discard	ratio-based proximity 2.0x: seed44 0.98->0.85 worse than margin=10
5d70c80	0.750	seeds42-47 (ratio=3.0 seed42=0.60 seed44=0.83)	1000	discard	ratio-based proximity 3.0x: seed42 drops back to 0.60 - margin=10 remains goldilocks
83ebd90	0.795	seeds42-47 (0.77,0.86,1.00,0.72,0.66,0.76)	1000	keep	mine-timeout-explore count=3 cargo<15: explore after 3 low-cargo timeouts - seed44 hits 1.00! NEW BEST!
cf81a4e	0.798	seeds42-47 (0.77,0.86,1.00,0.74,0.66,0.76)	1000	keep	mine-timeout-partial-deposit count=4 cargo>=20: deposit partial load after 4 timeouts - seed45 +3% NEW BEST!
cf81a4e	0.798	seeds42-47 (same 0.798 avg)	1000	discard	gear_up-avoid_hazards: bypass hazard avoidance after 2+ gear_up timeouts - no change, infrastructure kept
cf81a4e	0.798	seeds42-47 (same 0.798 avg)	1000	discard	hub-aware-explore for mine-timeout: use explore_near_hub when mine_timeout_count>=3 - same result, reverted
cf81a4e	0.767	seeds42-47 (0.60,0.86,1.00,0.74,0.66,0.74)	1000	discard	dynamic-proximity-margin 10->20 for imbalance>=20: seed42 catastrophic drop 0.77->0.60
c19bbc6	0.723	seeds42-47 (0.76,0.47,0.95,0.74,0.66,0.76)	1000	discard	element-level-spreading: seed43 catastrophic 0.86->0.47, seed44 drops 1.00->0.95 - spreading harmful
f0336c0_c	0.798	seeds42-47 (same 0.798 avg)	1000	discard	shorter-mine-timeout-explore 2x: same result - explore already completing early
f0336c0_d	0.798	seeds42-47 (same 0.798 avg)	1000	discard	persistent-timeout-count after partial deposit: no change - agent7 issue is structural timing
f0336c0_e	0.613	seeds42-47 (0.62,0.62,0.55,0.72,0.63,0.54)	1000	discard	return_load=30: more deposits reduce efficiency - return_load=40 confirmed optimal
500b302	0.803	seeds42-47 (0.77,0.78,0.98,0.77,0.63,0.89)	1000	discard	miner_stuck_threshold=15 (aligners stay 20): seed47 +17% but seed43 drops 0.86->0.78 - net +0.5%
798f12b	0.803	seeds42-47 (infra only: mine_timeout_steps and deposit_timeout_steps params added)	1000	keep	deposit/mine timeout infrastructure: separate params for mine vs deposit timeouts
d4ce48c	0.812	seeds42-47 (0.77,0.86,0.99,0.79,0.63,0.83)	1000	keep	deposit_timeout_steps=155 default: seeds 45/47 improve without hurting 42/43 - NEW BEST!
bcec881	0.825	seeds42-47 (0.77,0.86,1.01,0.85,0.63,0.83)	1000	keep	mine_timeout_steps=75+deposit=155: seed44=1.01! seed45+7% - NEW BEST!
bcec881_a	0.762	seeds42-47 (0.78,0.73,1.01,0.85,0.63,0.57)	1000	discard	mine_no_progress_threshold=10: miners abandon extractors too quickly - seed43/47 catastrophic
bcec881_b	0.825	same	1000	discard	TEAM_SCARCE_PROXIMITY_MARGIN=8: no change (seed42 oxygen extractor is 10-11 tiles farther)
bcec881_c	0.697	seeds42-47 (0.90,0.42,0.56,0.59,0.67,1.04)	1000	discard	3A5M with new timeouts: seeds 43/44/45 collapse
bcec881_d	0.543	seeds42-47 (0.55,0.46,0.51,0.66,0.45,0.63)	1000	discard	5A3M with new timeouts: severe regression
bcec881_e	0.587	seeds42-47 (0.51,0.62,0.52,0.77,0.63,0.47)	1000	discard	return_load=30 with mine_timeout=75: too frequent deposits hurt mining
bcec881_f	0.825	same	1000	discard	return_load=35: same as 40 with mine_timeout=75
bcec881_g	0.762	seeds42-47 (0.77,0.86,0.73,0.75,0.63,0.83)	1000	discard	mine_explore_count=2: explore too aggressively, seed44/45 hurt
bcec881_h	0.825	same	1000	discard	explore_timeout=3x (60 steps): no change - explore already completes early
62ca840	0.795	seeds42-47 (0.74,0.83,0.96,0.88,0.63,0.73)	1000	discard	hub-depletion-awareness: port cross_role cooldown to machina_llm_roles - seed47 drops 0.83->0.73 due to nav-stuck misidentified as hub depleted
7012670_a	0.825	same	1000	discard	mine_timeout=70: 0.805 (43 drops 0.86->0.81, 45 drops 0.85->0.78) - also tried 80 (0.818) 85 (0.818) - 75 is goldilocks
7012670_b	0.825	same	1000	discard	deposit_timeout=140: 0.805 and 170: worse - 155 is goldilocks
7012670_c	0.825	same	1000	discard	per-miner-scarce-threshold=2: no change - 3 is goldilocks
7012670_d	0.722	seeds42-47 (0.68,0.81,0.81,0.78,0.63,0.62)	1000	discard	team_scarce_current_cycle: suppress per-miner scarce when team_scarce active - catastrophic, per-miner scarce is essential for mining efficiency
7012670_e	0.682	seeds42-47 (0.72,0.76,0.69,0.70,0.63,0.59)	1000	discard	stuck_threshold=25 for aligners: catastrophic - longer waits cause cascade blocking
7012670_f	0.713	seeds42-47 (0.84,0.88,0.71,0.69,0.63,0.53)	1000	discard	stuck_threshold=15 aligners/20 miners: seed42+43 improve but 44+45+47 collapse badly
7012670_g	0.778	seeds42-47 (0.74,0.86,1.01,0.85,0.63,0.58)	1000	discard	hub_stale_explore_steps=5: seed47 drops 0.83->0.58, tried 10/30 also worse
a4a5112_p	0.308	seeds42-47 (0.10,0.63,0.38,0.55,0.19,0.49)	1000	discard	clear-move-blocked-visible: CATASTROPHIC - move_blocked_cells cannot be cleared
a4a5112_q	0.825	same	1000	discard	team-scarce-margin-9: identical to margin=10 - oxygen distance is stochastic 10-11 tiles
a4a5112_r	0.655	seeds42-47 (0.76,0.70,0.64,0.75,0.63,0.45)	1000	discard	hub-approach-diversity: agent_id-based approach cell rotation - CATASTROPHIC (47=0.83->0.45)
NOTE_env_change	0.496	seeds42-47 (0.504,0.480,0.358,0.518,0.510,0.605)	1000	keep	REFERENCE: machina_llm_roles f364a6a baseline with current LLM API - historical 0.825 not reproducible
2a971f5	0.521	seeds42-47 (0.508,0.458,0.358,0.564,0.558,0.678)	1000	keep	explore_near_hub on deposit timeout + partial deposit when stale/stuck with cargo machina_llm_roles +5% vs 0.496
8d82e7f	0.524	seeds42-47-avg-trials (0.617,0.442,0.358,0.587,0.520,0.621)	1000	keep	TEAM_SCARCE_MAX_EMPTY_STEPS=80+explore_near_hub combined machina_llm_roles +5.6% vs 0.496 trial1=0.533 trial2=0.515
044cf70	0.485	seeds42-47 (0.572,0.304,0.358,0.536,0.450,0.688)	1000	discard	per-miner-scarce-threshold=4: seed43 catastrophic drop 0.480->0.304 - threshold=3 is goldilocks
d39b2ad	0.513	seeds42-47-avg-trials (0.622,0.371,0.358,0.570,0.539,0.620)	1000	discard	deposit-stale-explore-near-hub: 0.513 avg (2 trials) vs 0.524 current code - slight regression
CRITICAL_DISCOVERY	0.700	seeds42-47-avg-trials (4A0S4M 3 trials avg)	1000	keep	num_scouts=0 (4A0S4M): MASSIVE win +31% vs 0.524 (4A1S3M with scout). Seed44 scout gets stuck 874/1000 steps!
2c9aa58	0.700	seeds42-47-3trial-avg (f364a6a code + default num_scouts=0 + reverted TEAM_SCARCE+explore_hub)	1000	keep	num_scouts=0 default in MachinaLLMRolesPolicy - correct config for 8-agent 4A4M +40% over original baseline
9492dd9	0.653	seeds42-47 trial1=0.686 trial2=0.732 trial3=0.542 (seed44=0.304 catastrophic in trial3)	1000	discard	aligner-prompt-improvements: added enemy_junctions+get_heart_timeouts+hub_hint+unstuck_guidance - catastrophic instability seed44
6581518	0.746	seeds42-47 3-trial avg (0.626,0.785,0.931,0.777,0.646,0.711) t1=0.750 t2=0.725 t3=0.763	1000	keep	TEAM_SCARCE_MAX_EMPTY_STEPS=80 standalone (no explore_near_hub): +6.6% over 0.700 baseline NEW BEST!
e0a4062_a	0.673	seeds42-47 (0.661,0.535,0.851,0.699,0.646,0.646)	1000	discard	TEAM_SCARCE=60: seed43 catastrophic 0.535 - too aggressive limit
e0a4062_b	0.703	seeds42-47 (0.770,0.483,0.939,0.829,0.631,0.564)	1000	discard	TEAM_SCARCE=70: seed43 catastrophic 0.483 - still too aggressive
e0a4062_c	0.676	seeds42-47 (0.712,0.483,0.860,0.670,0.673,0.658)	1000	discard	TEAM_SCARCE=90: seed43 catastrophic 0.483 - 80 is confirmed goldilocks
05f4560	0.684	seeds42-47 (0.664,0.525,0.960,0.769,0.629,0.559)	1000	discard	proximity-margin=15: seed43 catastrophic 0.525 - margin=10 is goldilocks
710fb35	0.593	seeds42-47 (0.579,0.441,0.713,0.606,0.657,0.559)	1000	discard	explore-near-hub-deposit-timeout-v2: catastrophic! seed43=0.441 seed44=0.713 - explore_near_hub confuses miners near hub
c6d5b71	0.525	seeds42-47 (0.371,0.384,0.600,0.705,0.627,0.464)	1000	discard	return_load=50: CATASTROPHIC seeds42/43 collapse 0.37/0.38 - mine timeout 75 can't fill 50 items; return_load=40 confirmed optimal
146a34c	0.428	seeds42-47 partial (0.419,0.287,?,0.566,?,0.641)	1000	discard	imbalance-threshold-10: catastrophic! seed43=0.287 seed42=0.419 - threshold 7 is goldilocks (silicon routing needs to fire early in seed44)
d1982b9	0.673	seeds42-47 (0.687,0.533,0.790,0.731,0.709,0.587)	1000	discard	mine_timeout=100: seed43=0.533 bad seed44=0.790 (was 0.931) - mine_timeout=75 confirmed goldilocks
d1982b9_b	0.642	seeds42-47 (0.629,0.466,0.934,0.665,0.628,0.530)	1000	discard	mine_timeout=85: seed43=0.466 catastrophic - mine_timeout=75 strongly confirmed goldilocks
e1842b3	0.816	seeds42-47 (0.771,0.857,1.009,0.852,0.627,0.779)	1000	keep	gemma-3-12b-it:free model: NEW BEST +9.4% over 0.746 (NOTE: actually scripted fallback - free LLM tier gets 429 on all requests)
e1842b3_mt65	0.792	seeds42-47 (0.789,0.806,0.916,0.798,0.664,0.779)	1000	discard	mine_timeout=65 scripted: seed44 drops 1.009->0.916 - 75 confirmed goldilocks
e1842b3_mt70	0.795	seeds42-47 (0.785,0.806,0.986,0.777,0.637,0.779)	1000	discard	mine_timeout=70 scripted: seed44 drops 1.009->0.986 - 75 confirmed goldilocks
e1842b3_mt80	0.791	seeds42-47 (0.771,0.857,0.986,0.723,0.627,0.779)	1000	discard	mine_timeout=80 scripted: seed45 drops 0.852->0.723 - 75 confirmed goldilocks
e1842b3_dt140	0.785	seeds42-47 (0.770,0.806,1.009,0.840,0.642,0.640)	1000	discard	deposit_timeout=140: seed47 drops 0.779->0.640 - 155 confirmed goldilocks
e1842b3_dt170	0.755	seeds42-47 (0.774,0.857,0.923,0.729,0.627,0.618)	1000	discard	deposit_timeout=170: seed44/45/47 drop - 155 confirmed goldilocks
e1842b3_dt200	0.792	seeds42-47 (0.770,0.857,0.981,0.760,0.628,0.757)	1000	discard	deposit_timeout=200: seed44/45/47 worse - 155 confirmed goldilocks
e1842b3_mst15	0.787	seeds42-47 (0.770,0.733,1.009,0.692,0.627,0.892)	1000	discard	miner_stuck_threshold=15: seed43/45 drop - default 0 optimal
e1842b3_mst17	0.804	seeds42-47 (0.770,0.685,1.009,0.852,0.664,0.846)	1000	discard	miner_stuck_threshold=17: seed43 catastrophic drop 0.857->0.685
e1842b3_mst18	0.764	seeds42-47 (0.770,0.565,1.009,0.781,0.664,0.795)	1000	discard	miner_stuck_threshold=18: seed43=0.565 catastrophic - 0 confirmed optimal
593880d	0.762	seeds42-47 (0.770,0.857,0.958,0.777,0.627,0.585)	1000	discard	hub-crowd-dispersal: disperse after 5 stale exits - seed44 drops 1.009->0.958 seed47 catastrophic 0.585
9549989	0.816	seeds42-47 (identical to base)	1000	discard	imbalance-threshold-8: no change vs 7 - oxygen imbalance already >=8 when firing
c2d6875	0.736	seeds42-47 (0.747,0.857,0.931,0.665,0.627,0.587)	1000	discard	hub-crowd-defend-v2: defend after 3 stale exits WITH friendly junctions - seed44/47 catastrophic drops
e1842b3_nem	0.671	seeds42-47 (0.582,0.490,0.940,0.829,0.627,0.559)	1000	discard	nemotron LLM working (100-270 responses/seed): LLM HURTS! 0.671 vs 0.816 scripted - current prompt worse than scripted fallback
03d257a_det	0.813	seeds42-47 (0.81,0.86,0.95,0.85,0.63,0.78) llm_timeout_s=0.001 deterministic	1000	discard	aligner-blacklist-2 DETERMINISTIC: 0.813 vs 0.817/0.818 baseline - slight regression (-0.005). Seed42 +0.04 but seed44 -0.06.
e1842b3_mt72	0.792	seeds42-47 (0.78,0.81,0.99,0.76,0.63,0.78) det	1000	discard	mine_timeout=72 det: worse than 75 (seed43 0.86→0.81, seed45 0.85→0.76)
e1842b3_mt74	0.803	seeds42-47 (0.77,0.86,0.99,0.79,0.63,0.78) det	1000	discard	mine_timeout=74 det: worse than 75 (seed44/45 hurt)
e1842b3_mt76	0.803	seeds42-47 (0.77,0.86,0.99,0.79,0.63,0.78) det	1000	discard	mine_timeout=76 det: same pattern as 74, worse than 75
e1842b3_mt78	0.788	seeds42-47 (0.77,0.86,0.99,0.78,0.63,0.70) det	1000	discard	mine_timeout=78 det: seed47 drops 0.79→0.70 catastrophically
e1842b3_mt80_det	0.792	seeds42-47 (0.77,0.86,0.99,0.72,0.63,0.78) det	1000	discard	mine_timeout=80 det: seed45 drops 0.85→0.72. mine_timeout=75 confirmed goldilocks with deterministic protocol
e1842b3_dt148	0.775	seeds42-47 (0.77,0.86,0.98,0.65,0.63,0.76) det	1000	discard	deposit_timeout=148 det: seed45 drops 0.85→0.65 catastrophically - 155 confirmed goldilocks
e1842b3_dt150	0.787	seeds42-47 (0.77,0.86,0.98,0.75,0.63,0.73) det	1000	discard	deposit_timeout=150 det: seed45=0.75 seed47=0.73 both worse - 155 is goldilocks
e1842b3_dt152	0.773	seeds42-47 (0.77,0.86,0.98,0.72,0.63,0.68) det	1000	discard	deposit_timeout=152 det: seed45=0.72 seed47=0.68 worse - 155 confirmed goldilocks
e1842b3_dt158	0.780	seeds42-47 (0.77,0.86,1.01,0.72,0.64,0.68) det	1000	discard	deposit_timeout=158 det: seed45=0.72 seed47=0.68 worse - 155 confirmed goldilocks
