commit	mission_reward	secondary_rewards	steps	status	description
14c7ac6	0.581	jh=2809 jg=2.94 hw=5.0	3000	discard	baseline: machina_roles (wrong policy) 2A+6M default config (3-ep avg)
14c7ac6	2.690	jh=23897 jg=53.7 hw=347	3000	keep	baseline: machina_llm_roles 4A+4M default config (3-ep avg)
14c7ac6	3.165	jh=23897 jg=53.7 hw=347	3000	keep	baseline: machina_llm_roles 4A+4M default config (5-ep avg)
f717a9c	2.717	jh=24163 jg=55.0	3000	discard	cascade-expand junction priority (+1% marginal not worth overhead)
0bd15cc	2.892	jh=25916 jg=62.0	3000	keep	5A+3M (fraction=0.625) (+7.5% vs baseline 3-ep)
0bd15cc	3.152	jh=25916 jg=62.0	3000	keep	5A+3M (fraction=0.6) + heart queue max(4) (5-ep avg)
c0667e8	2.182	jh=18825 jg=53.3	3000	discard	5A+3M stuck_threshold=15 + defend-when-starved (-24.6%)
01d4b01	2.497	jh=n/a jg=n/a	3000	discard	JUNCTION_ALIGN_DISTANCE=30 (-20.8%)
e11e905	3.265	jh=29655 jg=62.6	3000	keep	5A+3M + HUB_ALIGN_DISTANCE=30 + contam avoid (5-ep avg +3.2%)
273bbbb	3.000	jh=27000 jg=57.4	3000	discard	enemy junction priority bonus=-5 (-8.1%)
273bbbb	3.228	jh=29284 jg=56.6	3000	discard	enemy junction priority bonus=-2 (-1.1%)
273bbbb	1.809	jh=15090 jg=46.2	3000	discard	6A+2M fraction=0.75 (-44.6%)
273bbbb	2.408	jh=19871 jg=49.2	3000	discard	JUNCTION_ALIGN_DISTANCE=28 (-26.3%)
273bbbb	2.946	jh=26456 jg=58.4	3000	discard	L2 distance fix (game-accurate 15/25) (-9.8%)
273bbbb	2.345	jh=n/a jg=n/a	3000	discard	return_load=25 (-28.2%)
273bbbb	2.550	jh=22500 jg=51.0	3000	discard	get_heart timeout=60 (-21.9%)
273bbbb	3.417	jh=31174 jg=65.6	3000	keep	best: explore-not-defend after heart timeout (5-ep avg +4.7%)
273bbbb	3.283	jh=29831 jg=64.2	3000	keep	explore-not-defend (10-ep avg +0.5%)
ec2b9ca	3.469	jh=21176 jg=44.4	3000	keep	best: spread bonus 0.05 + junction deposit (10-ep avg +5.7%)
ec2b9ca	2.633	jh=n/a jg=n/a	3000	discard	return_load=30 (-24.1% vs 3.469)
ec2b9ca	3.574	jh=n/a jg=n/a	3000	discard	enemy recapture bonus=-5 gated travel<=15 (5-ep, weaker than -3)
4953971	3.619	jh=n/a jg=n/a	3000	keep	enemy recapture bonus=-3 gated travel<=15 (10-ep avg +4.3%)
4953971	3.766	jh=n/a jg=n/a	3000	discard	enemy recapture travel<=20 (5-ep, worse than <=15)
4953971	3.766	jh=n/a jg=n/a	3000	discard	enemy recapture travel<=10 (5-ep, worse than <=15)
4953971	3.076	jh=n/a jg=n/a	3000	discard	heart queue max(3) (-13.3%)
4953971	3.070	jh=n/a jg=n/a	3000	discard	stuck_threshold=25 (-26.5%)
dccb8c4	3.991	jh=n/a jg=n/a	3000	keep	best: stuck_threshold=15 (10-ep avg +10.3% vs 3.619)
dccb8c4	2.212	jh=n/a jg=n/a	3000	discard	split timeout get_heart*3/align_neutral*5 (-45.9% 5-ep)
dccb8c4	4.086	jh=n/a jg=n/a	3000	keep	baseline verification 5-ep avg (code at dccb8c4)
dccb8c4	3.421	jh=n/a jg=n/a	3000	discard	MOVE_COOLDOWN=3 (-16.3% 5-ep)
dccb8c4	3.532	jh=n/a jg=n/a	3000	discard	MOVE_COOLDOWN=4 (-13.6% 5-ep)
dccb8c4	3.880	jh=n/a jg=n/a	3000	discard	spread_bonus=0.10 (-5.0% 5-ep)
dccb8c4	3.844	jh=n/a jg=n/a	3000	discard	reclaim lost junctions bonus=-5 (-3.7% 10-ep)
dccb8c4	4.002	jh=n/a jg=n/a	3000	discard	explore cap stuck_threshold*1 (-2.1% 5-ep)
3da4e05	4.128	jh=62576 jg=78 deaths=2.75	3000	keep	best: enable aligner HP retreat (10-ep avg +3.4% vs 3.991)
3da4e05	3.377	jh=n/a jg=n/a	3000	discard	HP_RETREAT_THRESHOLD=0.55 (-17.4% 5-ep)
3da4e05	3.419	jh=n/a jg=n/a	3000	discard	HP_RETREAT_THRESHOLD=0.60 (-16.3% 5-ep)
3da4e05	3.293	jh=n/a jg=n/a	3000	discard	HP_RETREAT_THRESHOLD=0.80 (-19.4% 5-ep)
853adcd	4.559	jh=74628 jg=97 deaths=2.875	3000	keep	miner HP retreat 0.50 (10-ep avg +10.4% vs aligner-only)
853adcd	4.869	jh=n/a jg=n/a	3000	discard	miner HP retreat 0.70 (5-ep, worse than 0.60)
70819dc	4.751	jh=n/a jg=n/a	3000	keep	best: miner HP retreat 0.65 (10-ep avg +19.0% cumulative)
c84aa53	4.751	jh=n/a jg=n/a	3000	discard	miner HP resume 0.50->0.80 (10-ep zero effect)
e188235	3.402	jh=n/a jg=n/a	3000	discard	aligner explore direction spread (-28.4% 5-ep)
6595fd2	5.891	jh=n/a jg=n/a	3000	discard	late-game urgency mode step>=2500 (5-ep zero effect)
6ae1574	4.266	jh=n/a jg=n/a	3000	discard	sticky alignment target (-27.7% 5-ep)
6ea21af	0.967	jh=n/a jg=n/a	3000	discard	stale exit counts as timeout (-83.6% 5-ep CATASTROPHIC)
19c4b8e	2.626	jh=23261 jg=52.6 deaths=20.6	3000	discard	gear-up preferred side agent_id%4 (-35.7% 5-ep)
386c975	4.439	jh=41394 jg=66.1 hw=17.4	3000	discard	periodic get_heart retry 150 steps (-6.6% 10-ep)
386c975	3.914	jh=36136 jg=61.6 hw=29	3000	discard	heart progress bug fix + heart<5 patience<8 + retry=300 (-4.2% 5-ep)
386c975	3.066	jh=27657 jg=52.0 hw=22.8	3000	discard	heart progress bug fix only + retry=300 (-25.0% 5-ep)
d1512b0	4.255	jh=n/a jg=n/a	3000	discard	chain value scoring -2.0 per unlocked junction (-10.5% 5-ep)
02d0ec3	4.751	jh=n/a jg=n/a	3000	keep	early blacklist junctions at close range (0% effect 10-ep, harmless)
99c24c5	3.591	jh=n/a jg=n/a	3000	discard	two-tier HP retreat 85% in enemy territory (-24.5% 5-ep)
e9954fa	4.348	jh=n/a jg=n/a	3000	discard	conditional get_heart reset when queue<2 (-8.5% 10-ep)
cab9cfe	3.163	jh=n/a jg=n/a	3000	discard	anticipatory alignment via _is_alignable (-33.4% 10-ep)
8c6d562	4.521	jh=n/a jg=n/a	3000	discard	blacklist expiry 300 steps (-4.8% 10-ep)
197796d	4.381	jh=n/a jg=n/a	3000	discard	longer get_heart timeout stuck*7 (-7.8% 10-ep)
4413f9e	3.373	jh=n/a jg=n/a	3000	discard	heart accumulation patience 6 when 2+ hearts (-29.0% 10-ep)
e00fdcd	4.487	jh=n/a jg=n/a	3000	discard	frontier patrol: scan farthest friendly junction when no targets (-5.6% 10-ep)
06fd373	4.003	jh=n/a jg=49.4	3000	discard	4A+4M ratio (fraction=0.5) — fewer aligners can't compensate for more miners (-15.7% 10-ep)
09ccb44	3.894	jh=n/a jg=n/a	3000	discard	explore cap stuck_threshold*3 (45 steps) — too much time wandering (-18.0% 10-ep)
150eb9f	3.920	jh=n/a jg=n/a	3000	discard	miner deposit threshold -3 (more junction deposits) — hurts mining throughput (-17.5% 10-ep)
92a98ad	3.601	jh=n/a jg=n/a	3000	discard	cascade hub_dist weight 0.1 (was 0.2) — poor cascade building (-24.2% 10-ep)
7e39b44	4.126	jh=n/a jg=n/a	3000	discard	hub-biased retreat for heartless aligners (-13.2% 10-ep)
a1beeed	3.927	jh=n/a jg=n/a	3000	discard	nav-shake 4/2 (was 5/3) — too many random moves (-17.3% 10-ep)
9fb0118	3.337	jh=n/a jg=n/a	3000	discard	BFS agent collision avoidance via SharedMap positions (-29.8% 10-ep)
1d6fac6	3.037	jh=n/a jg=n/a	3000	discard	MOVE_COOLDOWN=8 (was 6) — too long avoidance creates dead zones (-36.1% 10-ep)
6368a4d	4.763	jh=n/a jg=n/a	3000	discard	late-game get_heart retry after step 2000 (+0.3% 10-ep, noise)
ea07b7d	3.732	jh=n/a jg=n/a	3000	discard	cascade expansion scoring -0.5 per unlocked junction (-21.4% 10-ep)
7268943	2.849	jh=n/a jg=n/a	3000	discard	heart accumulation patience 4 (was 3) — too long at hub (-40.0% 10-ep)
b21c56e	3.434	jh=n/a jg=n/a	3000	discard	skill timeout 4x (was 5x) — too short for distant targets (-27.7% 10-ep)
d816df6	4.751	jh=n/a jg=n/a	3000	discard	miner extractor depletion threshold 30 (was 40) — zero effect (0.0% 10-ep)
990843a	3.100	jh=n/a jg=n/a	3000	discard	miner MOVE_COOLDOWN=5 (was 6) — too fast creates congestion (-34.8% 10-ep)
0286cd3	0.000	jh=n/a jg=n/a	3000	discard	return_load=45 (was 40) — exceeds miner cargo cap 44, never deposits (aborted)
ad3032e	4.751	jh=n/a jg=n/a	3000	discard	miner STUCK_EXPLORE_STEPS=40 (was 60) — zero effect (0.0% 10-ep)
c922f52	4.751	jh=27012 jg=50.9	3000	discard	miner STUCK_THRESHOLD=120 (was 150) — zero effect (0.0% 10-ep)
8039203	4.587	jh=n/a jg=n/a	3000	discard	territory distance fix hub=20 junction=10 (was 15 both) — tighter junction radius causes more retreats (-3.4% 10-ep)
5e764a2	3.880	jh=n/a jg=n/a	3000	discard	remove hub_dist from cascade priority scoring — aligners wander too far (-18.3% 10-ep)
298413e	4.514	jh=n/a jg=n/a	3000	keep	new baseline verification (10-ep avg, new reward scale seeds 42-51)
d2e7905	3.316	jh=n/a jg=n/a	3000	discard	miner extractor hub_dist weight 1.0 (was 0.5) — over-biases to hub, ignores nearby extractors (-43.8% 5-ep)
fe4c071	3.634	jh=n/a jg=n/a	3000	discard	pure nearest extractor (no hub bias) — miners mine far from hub, waste travel time (-38.4% 5-ep)
90720a5	4.057	jh=n/a jg=n/a	3000	discard	heart queue limit max(3) (was max(4)) — too few aligners fetch hearts (-10.1% 10-ep)
7336f78	4.514	jh=n/a jg=n/a	3000	discard	enable aligner HP reading (was None) — zero effect in self-play (0% 5-ep)
769f5c4	3.461	jh=n/a jg=n/a	3000	discard	cascade hub_dist weight 0.3 (was 0.2) — too much hub bias (-23.3% 10-ep)
5cb7dee	4.380	jh=n/a jg=n/a	3000	discard	spread bonus -min(nearest,20)*0.1 (was -min(nearest,30)*0.05) — marginal loss (-3.0% 10-ep)
01d0264	3.206	jh=n/a jg=n/a	3000	discard	cascade network proximity bonus — biases to already-covered area, not new territory (-45.6% 5-ep)
903b1ec	4.514	jh=n/a jg=n/a	3000	discard	hub_search_25 — miner hub search distance 25 (was 20) — zero effect (0% contaminated run)
903b1ec	4.514	jh=n/a jg=n/a	3000	discard	aligner_resume_hp_gate — require HP>50% before resuming retreat — zero effect (0% self-play symmetry)
903b1ec	4.514	jh=n/a jg=n/a	3000	discard	wider_explore_frontier — expand frontier search radius when normal empty — zero effect (0% 10-ep)
e666023	2.909	jh=n/a jg=n/a	3000	discard	heart_patience_2 — reduce stale patience from 3 to 2 — fast cycling shifts advantage to Clips 3A (-50.7% 5-ep)
d9f1e1b	5.901	jh=n/a jg=n/a	3000	discard	team_scarce_gap_3 — reduce team scarce element threshold from 5 to 3 — zero effect (0% 5-ep)
283c8d5	5.882	jh=n/a jg=n/a	3000	discard	enemy_distance_scaled — distance-proportional enemy bonus -5*(1-travel/20) — zero effect (-0.3% 5-ep)
8e625ad	4.694	jh=n/a jg=n/a	3000	discard	nav_shake_6_4 — less aggressive shaking (6/4 vs 5/3) — agents stay stuck too long (-20.5% 5-ep)
82f44dd	3.652	jh=n/a jg=n/a	3000	discard	stuck_threshold_14 — reduce from 15 to 14 — agents give up too quickly (-38.1% 5-ep)
bac8c98	2.973	jh=n/a jg=n/a	3000	discard	junction_deposit_threshold_8 — increase from 5 to 8 steps closer — miners waste time walking to hub (-49.6% 5-ep)
b8f42df	4.122	jh=n/a jg=n/a	3000	discard	team_only_deconfliction — limit aligner deconfliction to same-team only — allows flip wars (-30.1% 5-ep)
a2c083f	3.640	jh=n/a jg=n/a	3000	discard	cascade_cluster_bonus — bias targeting toward clusters of unaligned junctions (-0.5 per nearby) — scatters aligners (-19.4% 5-ep)
73774aa	5.608	jh=n/a jg=n/a	3000	discard	network_chain_bonus — reward junctions near friendly network (-2.0 if within 15 cells) — over-clusters aligners (-4.96% 5-ep)
1c39337	5.901	jh=n/a jg=n/a	3000	baseline	FIX: restored junction_deposit_threshold from 8 back to 5 (bac8c98 was never reverted) — matches original baseline
1c39337	6.608	jh=n/a jg=n/a	10000	baseline	10k-step baseline with correct threshold=5 — +12.0% vs 3k baseline
902ac27	5.547	jh=n/a jg=n/a	3000	discard	stuck_threshold_18 — increase from 15 to 18 — slower to give up hurts (-6.0% 5-ep)
113e5fa	4.049	jh=n/a jg=n/a	3000	discard	territory_safe_mining — prefer extractors in friendly territory (-5.0 bonus) — over-constrains miners (-31.4% 5-ep)
4a7699a	4.354	jh=n/a jg=n/a	3000	discard	l2_alignable_check_18_28 — L2 distance in _is_alignable with radii 18/28 — loses Manhattan look-ahead (-26.3% 5-ep)
4a7699a	3.940	jh=n/a jg=n/a	3000	discard	l2_alignable_check_22_30 — L2 with larger radii 22/30 — still loses Manhattan look-ahead (-33.2% 5-ep)
14a2adb	4.689	jh=n/a jg=n/a	3000	discard	predicted_hazard_stations — predict non-miner stations from hub center, add to blocked_cells — creates nav barriers near hub (-20.5% 5-ep)
0094ee2	2.928	jh=n/a jg=n/a	3000	discard	aligner_fraction_065 — swap team ratios Cogs=3A1M/Clips=2A2M (was 2A2M/3A1M) — map asymmetry strongly favors current (-50.4% 5-ep)
3b762ae	5.871	jh=n/a jg=n/a	3000	discard	miner_noop_retreat — noop when retreating with empty cargo in friendly territory — zero effect (-0.5% 5-ep, noise)
07a3b7d	5.901	jh=n/a jg=n/a	3000	discard	heart_accumulate_3 — reduce heart accumulation threshold from 4 to 3 — zero effect (0.0% 5-ep, aligners never reach 3 hearts)
c167969	1.965	jh=n/a jg=n/a	3000	discard	get_heart_timeout_3x — reduce get_heart timeout from 5x to 3x stuck_threshold — catastrophic, aligners give up on hearts too fast (-66.7% 4-ep partial)
