commit	mission_reward	secondary_rewards	steps	status	description
be91f19	0.100000	aligned.junction.held=0	500	keep	Untrained LSTM baseline on competition map (10 episodes)
c96fc40	-0.780000	aligned.junction.held=0	1000	discard	RL from scratch (5 epochs braveheart arena + credit + milestones_2) - no progress
c96fc40	0.500000	aligned.junction.held=0 cell.visited=27584	500	keep	BC-pretrained policy (arena-only 98.93% acc) on arena - 5x baseline improvement
39bedda	0.050000	aligned.junction.held=0 clips.aligned=5520	500	discard	BC policy on competition map - worse than baseline (arena BC doesnt transfer)
39bedda	0.000000	aligned.junction.held=0	500	discard	BC→RL fine-tune (ent_coef=0.1) - entropy stuck at 0.109 - dead end
39bedda	0.070000	aligned.junction.held=180 aligned.junction=1	500	keep	BREAKTHROUGH: Curriculum p1 (max_dist=6) epoch 20 on competition map - first RL junction alignment ever!
654a0ac	0.050000	aligned.junction.held=0 cell.visited=16726	500	discard	Curriculum p1 epoch 30 on competition map - worse than epoch 20 (entropy rise degradation)
654a0ac	0.050000	aligned.junction.held=199 aligned.junction=0.33	500	discard	Curriculum p2 epoch 30 (arena max_dist=10) on competition - slight improvement but transfer gap
654a0ac	0.050000	aligned.junction.held=0	500	discard	Curriculum p2 epoch 50 (arena max_dist=10) on competition - over-specialized to arena layout
a8b294c	0.072000	aligned.junction.held=223 aligned.junction.gained=1.4	500	keep	BEST: Curriculum p1 epoch 90 (competition-map training, max_dist=6, aligner+credit) - 5-ep avg
a8b294c	0.343000	aligned.junction.held=249 cell.visited=551799	2500	keep	Epoch 90 at 2500 steps (3-ep avg) - reward scales with episode length
b855825	1.000000	aligned.junction.held=5.67 cell.visited=2519894	10000	keep	Epoch 90 at 10000 steps (3-ep) - reward=1.0 but from hearts not junctions
b855825	0.050000	aligned.junction.held=0	500	discard	Lowent (seed100 ent=0.005) epoch 30 on competition - doesn't transfer to natural maps
b855825	0.050000	aligned.junction.held=0	500	discard	Lowent epoch 55 on competition - also no transfer
b855825	0.050000	aligned.junction.held=0	500	discard	Lowent epoch 30 eval seed 100 - not seed-specific, curriculum close junctions dont generalize
b855825	0.050000	aligned.junction.held=0	500	discard	Highent (seed200 ent=0.03) epoch 90 on competition - same as lowent, fine-tuning from e90 doesnt transfer
c9da4c0	0.050000	aligned.junction.held=0	500	discard	Natural-map e50 (milestones_2:25+credit, 3000-step, seed42) - junction in training but not at 500 eval
c9da4c0	0.250000	aligned.junction.held=0	2500	discard	Natural-map e50 at 2500 steps - credit reward overrides junction nav, worse than original e90
c9da4c0	0.050000	aligned.junction.held=0 steps_without_motion=270	500	discard	Junction-only (milestones_2:25, no credit) e50 - agent learns to noop, sparse reward fails
c9da4c0	0.250000	aligned.junction.held=0 steps_without_motion=2295	2500	discard	Junction-only e50 at 2500 steps - agent stuck 2295/2500 steps, completely degenerate
06e7580	N/A	aligned.junction.held=5878_peak	3000	keep	BUGFIX: aligner variant penalizes other gear (-1.0 for miner/scout/scrambler). Removed it. flat_16env: flat map, open hub, start-aligner, 15x15 obs, max_dist=7. Peak 5878 held but sporadic (40% of evals) and dies after entropy drops below 1.25
06e7580	N/A	aligned.junction.held=51915_clips_vs_163_cogs	3000	discard	flat_v3: same as flat_16env but lower explore (0.005). Clips dominate junctions (51915 vs 163 held). Clips starve RL agents of reward signal.
fb9b750	~2.8/agent	aligned.junction.held=5385 per_agent_junctions=1.8	3000	keep	BREAKTHROUGH: minimal_align. No clips, start with aligner+heart, zero explore reward, flat map, max_dist=5, boost-aligner=5.0, milestones_2:100. Every eval shows alignment. Still simplified setup - transfer to competition pending.
fb9b750	7.78/agent	aligned.junction.held=20327_peak avg_last10=5.17	3000	keep	minimal_align PEAK at epoch 60-70. 22 evals: 1.19→7.78→1.97. Policy degrades after peak (PPO overshoot). Best checkpoints: model_000060.pt, model_000070.pt.
12c46db	1.81/agent	aligned.junction.held=2430 per_agent_junctions=~2	3000	keep	Phase 2a: max_dist=10, warm-start from Phase 1a model_000060. Transfer works! Growing: 1.10→1.44→1.73→1.81 in 4 evals. Still early.
