commit	mission_reward	secondary_rewards	steps	status	description
3c8d1e3	1126.0	seed42_8agent_cvc	2000	keep	baseline CvC seed 42 - no regression
3c8d1e3	1096.0	seed123_8agent_cvc	2000	keep	baseline CvC seed 123 - no regression
3c8d1e3	1228.0	seed7_8agent_cvc	2000	keep	baseline CvC seed 7 - no regression
3c8d1e3	0.0	aligner_hub_depletion_3	2000	reverted	hub threshold 1→3 regressed 60.52→36.74
3c8d1e3	0.0	aligner_defend_200	2000	reverted	defend duration 500→200 regressed →48.15
3c8d1e3	0.0	aligner_explore_defend	2000	reverted	explore during defend regressed →55.26
2917b81	86.76	enemy_junction_priority	2000	keep	enemy junction -5 bonus in cascade_priority_target (no CvC effect - online only)
2917b81	0.0	miner_drought_retarget	2000	reverted	drought mine_until_full creates tight depletion loops
2917b81	0.0	miner_extractor_claiming	2000	reverted	SharedMap contention penalty -3% to -8% regression
