commit	mission_reward	secondary_rewards	steps	status	description
cbbc1e9	32.815983	junction.held=0 heart.gained=17	500	keep	baseline: 8 agents static roles (pre-merge)
761fcb5	32.720016	junction.held=0 heart.gained=15	500	keep	post-merge: 8 agents proportional roles (no regression)
761fcb5	27.143950	junction.held=0 heart.gained=10	500	keep	4+4 noop: partner robustness test (A M A M assignment)
761fcb5	131.367661	junction.held=0 heart.gained=33	1000	keep	post-merge: 8 agents 1000 steps validation
a06c746	112.456070	junction.aligned=? heart.gained=30	1000	discard	cooldown 6→3 + stale 6→10 + clear on skill: REGRESSION
1cb4e88	96.224243	junction.aligned=26 heart.gained=29	1000	discard	stuck_threshold 20→30: REGRESSION (-26.7%)
da92655	137.783783	junction.aligned=35 heart.gained=36	1000	keep	aligner_fraction 62.5%→50% (4A+4M): +4.9% improvement
da92655	91.735855	junction.aligned=17 heart.gained=18	1000	keep	aligner_fraction 50% seed=43 validation
13fbfef	122.640000	5-seed avg (42-46)	1000	keep	4A+4M 5-seed avg: 137.78/91.74/109.78/164.04/109.86
13fbfef	115.630000	5-seed avg (42-46)	1000	discard	5A+3M 5-seed avg: 131.37/91.41/136.45/108.97/109.95
6590a17	129.320000	5-seed avg (42-46)	1000	keep	hub_dist 0.7→0.3: 157.54/84.93/118.04/159.16/126.92 (+5.4% vs 4A+4M)
6590a17	127.730000	5-seed avg (42-46)	1000	discard	junction deposit: 146.48/93.06/110.65/173.60/114.89 (-1.2% — delays make_heart)
696fb49	143.080000	5-seed avg (42-46)	1000	keep	multi-heart accum: 189.77/98.95/120.77/157.75/148.18 (+10.6%)
696fb49	3267.497559	junction.aligned=50 heart.gained=54	10000	info	10k scaling test: 408.44/agent, 53 junctions on map
9cdf565	162.380000	5-seed avg (42-46)	1000	keep	wait_time 3→6: 191.12/103.67/152.53/157.17/207.43 (+13.5% vs wait=3)
0e2b32d	171.730000	10-seed avg (42-51)	1000	keep	miner junction sharing: 246.13/91.11/134.85/169.41/149.15/139.11/216.19/193.78/203.37/174.16 (+5.7%)
