commit	mission_reward	secondary_rewards	steps	status	description
34212b3	3.519980	aligned.junction.gained=8;hearts.withdrawn=7;deaths=6;agent4_stuck=661	1000	keep	Baseline 8A machina_llm_roles num_aligners=4 scripted_miners=true (config from issue #25 body). Seed 42. total=3.52 per-agent=0.44. Target >4.0. Agent 4 (scout due to num_scouts default=1) stuck 661/1000 steps — same bug as comment #21.
451a536	5.548769	aligned.junction.gained=9;aligned.junction.held=5936;hearts.withdrawn=8;deaths=4;max_stuck=63	1000	keep	Exp1 8A machina_llm_roles num_aligners=4 num_scouts=0 scripted_miners=true llm_timeout_s=10 with OPENROUTER_API_KEY set. Seed 42. total=5.55 per-agent=0.69. Primary target EXCEEDED (+58% vs baseline). Agent 4 stuck count now 11 (vs 661). Stretch target 6.0 remains.
c7f493a	4.72	hearts_withdrawn=7;aligner_gear_final=4;miner_gear_final=1	1000	discard	Exp2 same as exp1 but kw.llm_model=google/gemma-3-12b-it:free. Seed 42. per-agent=0.59 total=4.72. WORSE than nemotron-super (exp1 5.55). Hypothesis from comment #23 (+9.4% gemma) does not hold at 8-agent — nemotron decisions actually help here. Discard; reset to ad049c2.
6a8e661	3.44	aligned.junction.held=3292;hearts_withdrawn=7;scout_contam=1;scrambler_contam=2;deaths=4	1000	discard	Exp3 5A3M split. num_aligners=5 num_scouts=0. Seed 42. per-agent=0.43 total=3.44. WORSE than exp1 (5.55). Extra aligner causes gear contamination: 3 aligner-lost events, 1 scout.gained, 2 scrambler.gained. Agent 2 lost 1300hp on contamination path. Discard.
de0c33f	5.839236	aligned.junction.gained=9;aligned.junction.held=6299;hearts_withdrawn=7;deaths=3;max_stuck=20	1000	keep	Exp4 3A5M split. num_aligners=3 num_scouts=0 (so 5 scripted miners). Seed 42. per-agent=0.730 total=5.84. NEW BEST (+5.2% over exp1 5.55). Cleaner gear acquisition (no aligner losses), less hub contention, +6% aligned.junction.held, fewer deaths (3 vs 4), max stuck agent at 20 steps (vs 63 in exp1). 97% of stretch 6.0.
a7e3662	5.252807	aligned.junction.gained=10;aligned.junction.held=5566;hearts_withdrawn=8;deaths=6	1000	discard	Exp5 exp4 + kw.stuck_threshold=12. Seed 42. per-agent=0.657 total=5.25. WORSE than exp4 (5.84). Junctions gained rose 9→10 but held dropped 6299→5566 and deaths doubled (3→6; 3 agents died twice each). Early bailout kills mid-alignment attempts and exposes aligners to clip damage. Discard.
84c3091	6.714414	aligned.junction.gained=13;aligned.junction.held=7393;hearts_withdrawn=10;deaths=10;max_action_failed=343	1000	keep	Exp6 exp4 + kw.stuck_threshold=28 (more patient). Seed 42. per-agent=0.839 total=6.71. STRETCH TARGET EXCEEDED (+14.9% over exp4). junctions.gained 9→13 (+44%), held 6299→7393, hearts 7→10, action.failed peak 727→343 (no more permanent hub spam). Deaths up 3→10 but reward gain dwarfs death cost. Scout gear contamination on 1 agent (unrecovered) did not block result.
3787b3f	6.289554	aligned.junction.gained=11;aligned.junction.held=6862;hearts_withdrawn=8;deaths=5;max_action_failed=476	1000	discard	Exp7 exp4 + kw.stuck_threshold=36. Seed 42. per-agent=0.786 total=6.29. Between exp4 (5.84) and exp6 (6.71) — so 28 is the local max. More patience let doomed targets eat more budget (action.failed peak 476). Discard; exp6 remains best.
849edbd	4.288820	seed=43;aligned.junction.gained=6;aligned.junction.held=4361;hearts_withdrawn=7;deaths=4;contam=scout+scrambler	1000	keep	Exp8 same config as exp6 (3A5M stuck=28) but --seed 43. per-agent=0.536 total=4.29. Above 4.0 primary but far below seed 42's 6.71. Gear contamination (scout+scrambler) costs ~1 gear loss. Different junction layout: only 6 junctions gained. Keep (still a verification data point).
849edbd	3.758408	seed=44;aligned.junction.gained=7;aligned.junction.held=3698;hearts_withdrawn=9;deaths=6;contam=scout+scrambler	1000	keep	Exp9 same config as exp6 but --seed 44. per-agent=0.470 total=3.76. Below 4.0 primary. 6 deaths, 2 aligner losses. This seed is structurally harder. Average across seeds 42-44: 4.92. Still +40% over the 3.356 pre-merge baseline.
06177e0	4.021576	seed=43;stuck=20;aligned.junction.gained=5;aligned.junction.held=4027;contam=scout+scrambler	1000	keep	Exp10a control: exp4 3A5M stuck_threshold=20 (default), --seed 43. per-agent=0.503 total=4.02. Slightly WORSE than stuck=28 on same seed (4.29). Confirms stuck=28 helps seed 43 too.
06177e0	3.800804	seed=44;stuck=20;aligned.junction.gained=6;aligned.junction.held=3751;contam=scout+scrambler	1000	keep	Exp10b control: exp4 3A5M stuck=20, --seed 44. per-agent=0.475 total=3.80. Essentially tied with stuck=28 on same seed (3.76). Difference ~0.04 is seed-level noise. Overall 3-seed avg: stuck=20 4.55 vs stuck=28 4.92. Stuck=28 confirmed +8% across seeds; keep.
326bf01	7.382405	seed=42;aligned.junction.gained=13;aligned.junction.held=8228;hearts_withdrawn=9;deaths=7;contam=0	1000	keep	Exp11a 3A5M stuck=28 + gear-up greedy fallback avoid_hazards. Seed 42. per-agent=0.923 total=7.38. NEW BEST single-seed (+10% over exp6 6.71). No gear contamination (0 scout/scrambler gained, 0 aligner lost). aligned.junction.held 7393->8228 (+11%).
326bf01	4.131984	seed=43;aligned.junction.gained=5;aligned.junction.held=4165;hearts_withdrawn=5;deaths=4;contam=scout1+scrambler1+align_lost1	1000	keep	Exp11b same fix, --seed 43. total=4.13 vs exp6 4.29. The fix does NOT catch the contamination path on this seed — still 1 scout + 1 scrambler gained, 1 aligner lost. Likely contamination from _get_heart (uses avoid_hazards=False intentionally).
326bf01	3.603215	seed=44;aligned.junction.gained=7;aligned.junction.held=3504;hearts_withdrawn=7;deaths=7;contam=scout1+scrambler1+align_lost2	1000	keep	Exp11c same fix, --seed 44. total=3.60 vs exp6 3.76. Contamination persists (1+1+2). 3-seed avg exp11: 5.04 vs exp6 4.92 (+0.12). Mostly driven by seed 42 headroom from unblocking adjacent-cell deadlock. Keep; next exp tries _get_heart avoid_hazards.
745375e	4.429616	seed=42;aligned.junction.gained=7;aligned.junction.held=4537;hearts_withdrawn=7;deaths=10;contam=0	1000	keep	Exp12a _get_heart + _align_neutral prefer hazard-free BFS. Seed 42. total=4.43 vs exp11 7.38. Regression: hazard-free path is longer, aligners spend more time routing. 0 contamination but fewer junctions gained (7 vs 13).
745375e	5.035197	seed=43;aligned.junction.gained=7;aligned.junction.held=5294;hearts_withdrawn=6;deaths=5;contam=scout1+scrambler1+align_lost1	1000	keep	Exp12b same fix, --seed 43. total=5.04 vs exp11 4.13. IMPROVED. Contamination persists on this seed (1+1+1) suggesting another path remains, but junctions still +2 and held +27%.
745375e	5.425539	seed=44;aligned.junction.gained=9;aligned.junction.held=5782;hearts_withdrawn=6;deaths=9;contam=0	1000	keep	Exp12c same fix, --seed 44. total=5.43 vs exp11 3.60. HUGE improvement (+51%). 0 contamination, junctions 7->9 (+29%), held 3504->5782 (+65%). 3-seed min rose 3.60->4.43 (robustness), avg 5.04->4.97 (slightly down). All 3 seeds now above 4.0 primary target.
364e701	4.944802	seed=42;aligned.junction.gained=13;aligned.junction.held=5181;deaths=8;contam=aligner_lost1	1000	discard	Exp13a revert _align_neutral BFS to avoid_hazards=False (keep _gear_up/_get_heart hazard-free). Seed 42 4.94 vs exp12 4.43 (+0.51). But seeds 43/44 catastrophically regressed.
364e701	3.593585	seed=43;aligned.junction.gained=5;aligned.junction.held=3492;deaths=10;contam=scout1+aligner_lost1	1000	discard	Exp13b same revert, seed 43. total=3.59 vs exp12 5.04 (-1.45). Huge regression.
364e701	3.492009	seed=44;aligned.junction.gained=6;aligned.junction.held=3365;deaths=8;contam=0	1000	discard	Exp13c same revert, seed 44. total=3.49 vs exp12 5.43 (-1.94). Huge regression. 3-seed avg 4.01, min 3.49. Revert is clearly worse. Discard; restore exp12 aligner_agent.py.
e5740a5	2.508764	seed=45;aligned.junction.gained=4;aligned.junction.held=2136;hearts_withdrawn=5;deaths=1;contam=0	1000	keep	Exp14a 6-seed verification for exp12 best. Seed 45. total=2.51 per-agent=0.314. Below primary 4.0. 0 contamination so not a gear issue; map structurally short on alignable junctions (only 4 gained).
e5740a5	3.633625	seed=46;aligned.junction.gained=5;aligned.junction.held=3542;hearts_withdrawn=5;deaths=0;contam=0	1000	keep	Exp14b same config, seed 46. total=3.63 per-agent=0.454. Below primary 4.0. 0 deaths (surprising, no clips damage), 0 contamination, just few junctions (5). Comment #24 noted seed 46 has structural hub crowding.
e5740a5	7.964054	seed=47;aligned.junction.gained=12;aligned.junction.held=8955;hearts_withdrawn=8;deaths=8;contam=0	1000	keep	Exp14c same config, seed 47. total=7.96 per-agent=0.996. NEW BEST single-seed (stretch target exceeded by 33%). 12 junctions gained, 8955 held. 6-seed avg for exp12 config: 4.83, min 2.51. Aggregate: 4 of 6 seeds above primary 4.0.
de451a1	49.919903	junction_aligned=6;hearts_gained=7;deaths=0;contam=0;max_stuck=98	1000	keep	Exp15a miner-junction-discovery. Seed 42. total=49.92 (mettagrid 0.15.0 scale). Baseline was 44.95 (+11.0%). Junctions 5→6. Hearts 6→7. 0 contamination.
de451a1	72.416283	junction_aligned=11;hearts_gained=12;deaths=0;contam=0;max_stuck=43	1000	keep	Exp15b miner-junction-discovery. Seed 45 (hard). total=72.42. Baseline was 50.84 (+42.4%). Junctions 6→11 (+83%). Hearts 7→12. 0 contamination.
de451a1	74.152016	junction_aligned=10;hearts_gained=10;deaths=0;contam=0;max_stuck=82	1000	keep	Exp15c miner-junction-discovery. Seed 46 (hard). total=74.15. Baseline was 57.77 (+28.4%). Junctions 7→10 (+43%). Hearts 7→10. 0 contamination.
de451a1	92.072411	junction_aligned=14;hearts_gained=14;deaths=4;contam=0;max_stuck=122	1000	keep	Exp15d miner-junction-discovery. Seed 47 (best). total=92.07. Junctions=14 (vs 12 in exp14 old scale). Hearts=14. 0 contamination. 4-seed avg 72.14 (+27.9% vs baseline avg 51.19).
b985510	52.039825	junction_aligned=6;hearts_gained=7;deaths=2;contam=0;max_stuck=113	1000	discard	Exp16a align-distance-increase. Seed 42. total=52.04. Marginal vs exp15 (49.92 +4.2%). Same junction count.
b985510	79.615807	junction_aligned=13;hearts_gained=14;deaths=0;contam=0;max_stuck=43	1000	discard	Exp16b align-distance-increase. Seed 45. total=79.62. Better than exp15 (72.42 +9.9%). Junctions 11→13.
b985510	74.152016	junction_aligned=10;hearts_gained=10;deaths=0;contam=0;max_stuck=82	1000	discard	Exp16c align-distance-increase. Seed 46. total=74.15. Identical to exp15. No effect.
b985510	51.799755	junction_aligned=7;hearts_gained=7;deaths=2;contam=0;max_stuck=94	1000	discard	Exp16d align-distance-increase. Seed 47. total=51.80. CATASTROPHIC regression vs exp15 (92.07 -43.7%). Junctions 14→7. Discard; revert distances to 25/15.
0a2fdb7	48.136024	junction_aligned=6;hearts_gained=7;deaths=0;scout_gained=1;max_stuck=84	1000	discard	Exp17a stuck=20 redux. Seed 42. Worse than exp15 (49.92). Scout contamination. stuck=28 is still better.
0a2fdb7	76.584198	junction_aligned=13;hearts_gained=14;deaths=0;contam=0;max_stuck=57	1000	discard	Exp17b stuck=20. Seed 45. Better than exp15 (72.42) but seed 47 regression kills it.
0a2fdb7	57.551483	junction_aligned=7;hearts_gained=7;deaths=1;scrambler_gained=1;aligner_lost=1;max_stuck=97	1000	discard	Exp17c stuck=20. Seed 47. CATASTROPHIC regression vs exp15 (92.07 -37.5%). Contamination from premature target abandonment. Discard.
0a2fdb7	58.287479	junction_aligned=7;hearts_gained=7;deaths=2;contam=0;max_stuck=185	1000	discard	Exp18a 4A4M. Seed 42. Better than exp15 3A5M (49.92) but contamination on other seeds kills it.
0a2fdb7	44.608242	junction_aligned=5;hearts_gained=7;deaths=2;scout_gained=1;aligner_lost=1;max_stuck=182	1000	discard	Exp18b 4A4M. Seed 45. Much worse than exp15 3A5M (72.42 -38.4%). Gear contamination still active.
0a2fdb7	61.655525	junction_aligned=8;hearts_gained=8;deaths=0;aligner_lost=1;max_stuck=138	1000	discard	Exp18c 4A4M. Seed 47. Much worse than exp15 3A5M (92.07 -33.0%). Aligner lost=1.
4ea4c03	38.064491	junction_aligned=4;hearts_gained=5;deaths=1;contam=0;max_stuck=122	1000	discard	Exp19a return_load=28. Seed 42. Worse than exp15 (49.92 -23.8%). Less mining time = fewer hearts.
4ea4c03	57.247410	junction_aligned=8;hearts_gained=10;deaths=0;contam=0;max_stuck=46	1000	discard	Exp19b return_load=28. Seed 45. Worse than exp15 (72.42 -21.0%). 3 fewer junctions.
4ea4c03	83.720474	junction_aligned=11;hearts_gained=11;deaths=0;contam=0;max_stuck=134	1000	discard	Exp19c return_load=28. Seed 47. Worse than exp15 (92.07 -9.1%). 3 fewer junctions.
bd8e4a7	37.736198	junction_aligned=5;hearts_gained=6;deaths=3;aligner_gained=1	1000	discard	Exp20a miner-share-aligner-stations. Seed 42. REGRESSION vs exp15 (49.92 -24.4%). Only 1/3 aligners got gear.
bd8e4a7	24.335806	junction_aligned=3;hearts_gained=5;deaths=2;scrambler_gained=1;aligner_lost=1	1000	discard	Exp20b miner-share-aligner-stations. Seed 45. CATASTROPHIC vs exp15 (72.42 -66.4%). Contamination back.
bd8e4a7	36.568462	junction_aligned=4;hearts_gained=4;deaths=1;aligner_gained=1	1000	discard	Exp20c miner-share-aligner-stations. Seed 47. CATASTROPHIC vs exp15 (92.07 -60.3%). Only 1/3 aligners got gear. Bug in station tag resolution.
