commit	mission_reward	secondary_rewards	steps	status	description
ee5a781	0.578	seeds42-47 (0.63,0.69,0.56,0.47,?,?) det	1000	discard	multi-heart-2: CATASTROPHIC - aligners wait for 2 hearts but hub depletes, causes get_heart_timeouts → defend mode, kills alignment
e1842b3_dt160	0.768	seeds42-47 (0.77,0.86,1.01,0.72,0.63,0.62) det	1000	discard	deposit_timeout=160 det: seed45=0.72 seed47=0.62 worse - 155 is the strong goldilocks
e314831	0.817	seeds42-47 (0.77,0.86,1.01,0.85,0.63,0.78) det	1000	discard	enemy-priority-alignment: NO CHANGE - stale known_enemy_junctions prevents detection of enemy recaptures
6aad611_ts12	0.817	seeds42-47 (same as baseline) det	1000	discard	team-scarce threshold 14→12 imbalance 7→6: NO CHANGE - routing activated earlier but no impact
6aad611_5align	0.543	seeds42-47 (catastrophic) det	1000	discard	5 aligners 3 miners: CATASTROPHIC - hub depletes with only 3 miners; 4A4M confirmed optimal split
6aad611_st15	0.695	seeds42-47 det	1000	discard	aligner stuck_threshold=15: significantly worse - faster give-up hurts alignment persistence
6aad611_st25	0.628	seeds42-47 det	1000	discard	aligner stuck_threshold=25: catastrophic - longer waits cause cascade blocking
6aad611_pad30	0.655	seeds42-47 det	1000	discard	post-align defend 30 steps: worse - standing at junctions after aligning reduces total alignment count
6aad611_pad15	0.700	seeds42-47 det	1000	discard	post-align defend 15 steps: worse - even brief post-align pause hurts throughput
6aad611_pad50	0.637	seeds42-47 det	1000	discard	post-align defend 50 steps: catastrophic - confirmed post-align defend is uniformly bad
6aad611_rl30	0.597	seeds42-47 det	1000	discard	return_load=30: too-frequent deposits hurt mining efficiency
6aad611_rl50	0.572	seeds42-47 det	1000	discard	return_load=50: catastrophic - mine_timeout=75 can't fill 50 items
6aad611_ad	0.778	seeds42-47 det	1000	discard	align distance increase: slightly worse - 0.778 vs 0.817 baseline
6aad611_mc20	0.817	seeds42-47 det	1000	discard	mine-timeout cargo<20 explore threshold (was <15): no improvement or slight regression
6aad611_hd2	0.760	seeds42-47 det	1000	discard	hub-depletion get_heart threshold 1→2 timeouts: 0.760 - aligners switch to defend too late
6aad611_dt200	0.810	seeds42-47 det	1000	discard	defend timeout 200 steps: 0.810 - slightly worse than 1000 steps full-game (0.817)
6aad611_dt400	0.810	seeds42-47 det	1000	discard	defend timeout 400 steps: 0.810 - no improvement; full-game defend confirmed better
6aad611_rcp	0.780	seeds42-47 det	1000	discard	recapture-priority: 0.780 - tracking previously-aligned junctions in SharedMap; seed43 catastrophic 0.86→0.64
fe9f0d3	0.778	seeds42-47 (0.75,0.86,0.88,0.85,0.63,0.70) det	1000	discard	shared-team-blacklist: WORSE - team blacklist too aggressive; seed44 1.01→0.88 catastrophic
6aad611_ss	0.738	seeds42-47 (0.71,0.66,0.93,0.77,0.63,0.73) det	1000	discard	sector-spread alignment: 0.738 WORSE - seeds 43/44 catastrophic; farther junctions hurt cycle time
75c1b95	0.677	seeds42-47 (0.75,0.65,0.79,0.78,0.63,0.46) det	1000	discard	hub-stale-unstuck: 0.677 CATASTROPHIC - unstuck escapes hub, seed47 0.78→0.46; explore-after-stale was correct behavior
6aad611_hsd28	0.772	seeds42-47 (0.77,0.81,1.01,0.87,0.63,0.54) det	1000	discard	hub_search_distance=28 (was 20): 0.772 WORSE - seed47 catastrophic 0.78→0.54; aligners explore too far from hub initially
65c8067_hp40	0.663	seeds42-47 (0.60,0.68,0.83,0.66,0.63,0.58) det	1000	discard	hub_patience=40: CATASTROPHIC - aligners wait too long at empty hub; 20 steps confirmed goldilocks
65c8067_hp25	0.700	seeds42-47 (0.82,0.74,0.69,0.68,0.63,0.64) det	1000	discard	hub_patience=25: WORSE - hub wait 5 extra steps hurts alignment throughput
65c8067_hp15	0.743	seeds42-47 (0.73,0.85,0.75,0.72,0.63,0.78) det	1000	discard	hub_patience=15: WORSE - less patience hurts; 20 steps is goldilocks for hub wait
48e9874	0.817	seeds42-47 (0.77,0.86,1.01,0.85,0.63,0.78) det	1000	discard	circuit-patrol: NO CHANGE - last_aligned_junction preference; already selecting nearest naturally
e4fd84c	0.717	seeds42-47 (0.59,0.72,0.85,0.70,0.65,0.79) det	1000	discard	junction-decay stale 220 step_counts: WORSE - aligners waste hearts re-aligning still-friendly junctions
756be81	0.780	seeds42-47 (0.77,0.85,0.93,0.85,0.63,0.65) det	1000	discard	defend-on-timeout: WORSE - seed44=0.93 seed47=0.65 regress; get_heart_timeouts>=1 fires even without hub depletion
f6eec91	0.670	seeds42-47 (0.68,0.77,0.52,0.86,0.63,0.56) det	1000	discard	avoid-hazards-get-heart: CATASTROPHIC - hazard detours make hub trips too long; avg 0.670
fc7846f	0.817	seeds42-47 (0.77,0.86,1.01,0.85,0.63,0.78) det	1000	discard	territory-distance-10 (was 15): NO CHANGE - retreat mechanism irrelevant to reward in these seeds
41925fa	0.817	seeds42-47 (0.77,0.86,1.01,0.85,0.63,0.78) det	1000	discard	hp-commit-override (push through alignment when <=8 steps from junction): NO CHANGE - HP retreat rarely/never triggered
4fcf4a2	0.800	seeds42-47 (0.67,0.86,1.01,0.85,0.63,0.78) det	1000	discard	bfs-junction-select: WORSE - seed42=0.67 dropped. BFS only considers known_free_cells junctions; early-game misses unexplored junctions
29529f3	0.775	seeds42-47 (0.77,0.86,1.01,0.85,0.63,0.53) det	1000	discard	depleted-extractor-fix: WORSE - seed47=0.53 crashed; falsely depleted extractors removed from routing permanently
29e3b1a	0.762	seeds42-47 (0.77,0.86,0.93,0.85,0.63,0.53) det	1000	discard	total-threshold-56: WORSE - seed47 crashes 0.78→0.53; delayed activation hurts early element balance
45785b9	0.762	seeds42-47 (0.77,0.86,0.93,0.85,0.63,0.53) det	1000	discard	min-count-1-filter: WORSE - preventing routing when any element=0 blocks seed44 silicon and seed47 germanium early routing; 0→10 deposit window is critical
4c1b887	0.792	seeds42-47 (0.77,0.86,1.01,0.85,0.63,0.63) det	1000	discard	local-stale-extractors: WORSE - per-miner stale avoidance prevents seed47 germanium routing (Ge extractor frequently stale); 0.78→0.63
97453ca	0.817	seeds42-47 (0.77,0.86,1.01,0.85,0.63,0.78) det	1000	discard	team-scarce-cap-50: NO CHANGE - Ge extractor in seed47 already within 45 tile cap; proximity margin is binding constraint
b15e046_m11	0.817	seeds42-47 (0.77,0.86,1.01,0.85,0.63,0.78) det	1000	discard	margin-11: NO CHANGE - Ge extractor in seed47 within current margin; not the binding constraint
b15e046_m12	0.817	seeds42-47 (0.77,0.86,1.01,0.85,0.63,0.78) det	1000	discard	margin-12: NO CHANGE - margin is not binding for seed47
b15e046_5a3m	0.543	seeds42-47 (0.55,0.46,0.51,0.66,0.45,0.63) det	1000	discard	5A3M: CATASTROPHIC - only 3 miners insufficient for heart production; 4A4M confirmed optimal
b15e046_3a5m	0.697	seeds42-47 (0.90,0.42,0.56,0.59,0.67,1.04) det	1000	discard	3A5M: WORSE - fewer aligners hurt overall; 4A4M optimal
b15e046_rl30	0.597	seeds42-47 (0.51,0.68,0.52,0.77,0.63,0.47) det	1000	discard	return_load=30: WORSE - re-confirmed goldilocks 40 even with new goldilocks params
b15e046_st18	0.793	seeds42-47 (0.78,0.62,0.95,0.87,0.63,0.91) det	1000	discard	stuck_threshold=18 (all): seed43 catastrophic (0.62); seeds 45/47 improve but net worse
b15e046_st18m20	0.767	seeds42-47 (0.77,0.74,0.95,0.88,0.63,0.63) det	1000	discard	stuck=18 aligners / 20 miners: seed43 partially recovered (0.74) but still worse; seed47 drops 0.78→0.63
b15e046_st20m18	0.765	seeds42-47 (0.77,0.57,1.01,0.78,0.66,0.80) det	1000	discard	stuck=20 aligners / 18 miners: seed43 catastrophic (0.57); miner stuck-threshold=20 is goldilocks
b15e046_pm5	0.798	seeds42-47 (0.75,0.77,1.01,0.85,0.63,0.78) det	1000	discard	per-miner-scarce-threshold=5: seed43 drops 0.86→0.77; threshold=3 is goldilocks
b15e046_def-expl	0.767	seeds42-47 (0.78,0.75,0.99,0.85,0.64,0.59) det	1000	discard	defend=explore-near-hub: seed47 catastrophic (0.78→0.59); defending aligners must stay near hub for heart pickup
a1801b6	0.732	seeds42-47 (0.77,0.86,0.71,0.85,0.63,0.57) det	1000	discard	explore-toward-neutral-junctions: CATASTROPHIC - aligners explore too broadly; neutral junction anchors spread exploration
9544639_v1	0.720	seeds42-47 (0.90,0.71,0.74,0.74,0.63,0.59) det	1000	discard	team-in-transit additive (effective=deposits+in_transit): seed42 improved but 43/44/45/47 all drop; additive approach changes relative magnitudes
9544639_v2	0.778	seeds42-47 (0.87,0.81,0.73,0.88,0.63,0.75) det	1000	discard	team-in-transit veto threshold=7 (any deposits): seed44 drops 1.01→0.73; threshold too low
9544639_v3	0.780	seeds42-47 (0.85,0.86,0.72,0.85,0.63,0.74) det	1000	discard	team-in-transit veto threshold=15: seed44 still drops 1.01→0.72; Si has 15+ in transit naturally
9544639_v4	0.817	seeds42-47 (0.85,0.86,1.01,0.85,0.63,0.53) det	1000	discard	team-in-transit veto threshold=25: seed44 restored but seed47 drops 0.78→0.53 (Ge has 25+ in transit normally)
9544639_v5	0.756	seeds42-47 (0.77,0.86,0.93,0.85,0.63,0.53) det	1000	discard	team-in-transit veto deposits==0 AND in_transit>=5: seed44 drops (Si=0 early gets vetoed); same problem for seed47 Ge
156d61b	0.773	seeds42-47 (0.73,0.82,0.85,0.85,0.69,0.70) det	1000	discard	cycle-time-junction-select 2x hub weight: seed46 +0.06 but seeds42/43/44/47 all regress; hub-far junctions penalized too much
156d61b_1x	0.788	seeds42-47 (0.73,0.82,0.93,0.85,0.71,0.69) det	1000	discard	cycle-time 1x hub weight: seed46 +0.08 but seeds42/43/44/47 still worse; consistent tradeoff not net positive
156d61b_hn	0.738	seeds42-47 (0.74,0.73,0.78,0.85,0.64,0.69) det	1000	discard	hub-near-first: prefer junctions within HUB_ALIGN_DISTANCE - CATASTROPHIC seeds42/43/44 all drop; forces long detours to hub-near junctions
ff32914	0.390	seeds42-47 (0.10,0.63,0.38,0.55,0.19,0.49) det	1000	discard	stale-move-blocked-fix: CATASTROPHIC - clearing move_blocked_cells removes station positions (non-wall but blocking); avg 0.39
total_thresh_28	0.817	seeds42-47 (same) det	1000	discard	total-threshold-28: no change - false-positive fires after 28 deposits anyway
total_thresh_42	0.778	seeds42-47 (0.77,0.86,0.93,0.85,0.63,0.53) det	1000	discard	total-threshold-42: seeds 44/47 drop catastrophically; routing too delayed
5d4f8e8_c2	0.817	seeds42-47 (same) det	1000	discard	extractor-crowding threshold=2: no change - crowding rarely occurs at scarce extractor
5d4f8e8_c1	0.807	seeds42-47 (0.77,0.86,0.92,0.85,0.63,0.78) det	1000	discard	extractor-crowding threshold=1: seed44 drops 1.01→0.92; too aggressive, prevents valid routing
ae88b38	0.693	seeds42-47 (0.72,0.77,0.77,0.82,0.63,0.45) det	1000	discard	aligner-timeout-70: get_heart/align_neutral timeout 100→70 steps; aligners abandon routes too fast
9fcb73c_80	0.722	seeds42-47 (0.65,0.86,0.81,0.77,0.63,0.61) det	1000	discard	aligner-timeout-80: timeout=80 steps; still worse than 100; 100 is goldilocks
a363305_t12	0.817	seeds42-47 (same as baseline) det	1000	discard	team_deposits threshold=12/7: no change - threshold not the active constraint
a363305_cvc	0.782	seeds42-47 (0.77,0.86,1.01,0.64,0.63,0.78) det	1000	discard	cargo-aware-scarce: threshold=1 when cargo<20, else 3; seed45 drops 0.85→0.64
a363305_cv5	0.812	seeds42-47 (0.77,0.86,0.98,0.85,0.63,0.78) det	1000	discard	chain-value bonus=5: seed44 drops 1.01→0.98; nearest-first is goldilocks
b769840	0.825	seeds42-47 (0.77,0.86,1.06,0.85,0.63,0.78) det	1000	keep	deposit-backoff: exponential backoff explore after deposit failure; seed44 1.01→1.06 NEW BEST
9d43c8b_tsgate	0.777	seeds42-47 (0.77,0.82,0.98,0.85,0.63,0.78) det	1000	discard	agent_id team-scarce gating (id%4==0 for agent_id 0): seed43 drops 0.86→0.82
9d43c8b_enaj	0.713	seeds42-47 (0.77,0.79,0.68,0.85,0.63,0.54) det	1000	discard	explore toward non-alignable junctions: seeds44/47 catastrophic; aligners chased enemy junctions far from hub
deabbb1	0.463	seeds42-47 (catastrophic) det	1000	discard	hub-approach-no-block: CATASTROPHIC - hub structure has permanent walls/stations in move_blocked_cells; cannot clear them
9d43c8b_apc	0.765	seeds42-47 (0.77,0.86,0.98,0.85,0.63,0.62) det	1000	discard	approach-cell-cycling: cycle through 3 approach cells per deposit - seed47 drops 0.78→0.62; farther approach cells cost more steps
9d43c8b_ja16	0.775	seeds42-47 (0.77,0.86,0.92,0.85,0.63,0.78) det	1000	discard	JUNCTION_ALIGN=16 (was 15): seed44 drops 1.06→0.92; 15 is goldilocks
9d43c8b_ha26	0.803	seeds42-47 (0.79,0.86,0.93,0.85,0.63,0.78) det	1000	discard	HUB_ALIGN=26 (was 25): per-seed tradeoff; seeds 42/46 slightly benefit but 43/44/47 worse; 25 is goldilocks
9d43c8b_hsd22	0.777	seeds42-47 (0.77,0.86,0.93,0.85,0.63,0.78) det	1000	discard	HUB_SEARCH=22 (was 20): seed44 drops 1.06→0.93; 20 is goldilocks for hub search radius
9d43c8b_sbe	0.688	seeds42-47 (0.77,0.86,0.63,0.85,0.63,0.28) det	1000	discard	sector-based exploration: barren quadrant problem - some sectors had no junctions; seeds 42/43/44 collapsed
87e550f	0.735	seeds42-47 (0.72,0.73,0.91,0.88,0.63,0.54) det	1000	discard	align_neutral timeout split: align_neutral=3x(60s) get_heart=5x(100s); over-eager blacklisting cascade; much worse than baseline
9d43c8b_im9	0.825	seeds42-47 (0.77,0.86,1.06,0.85,0.63,0.78) det	1000	discard	imbalance threshold 7→9: NO CHANGE - oxygen imbalance in seed42 is already >=9 when routing fires; cannot reduce false positives this way
9d43c8b_mst22	0.758	seeds42-47 (0.77,0.70,1.06,0.75,0.63,0.64) det	1000	discard	miner_stuck_threshold=22: seeds 43/45/47 catastrophic drop; miner patience 20 is goldilocks
9d43c8b_mst21	0.753	seeds42-47 (0.77,0.72,1.06,0.75,0.63,0.59) det	1000	discard	miner_stuck_threshold=21: also catastrophic; miner_stuck_threshold > 20 uniformly bad
5386372	0.825	seeds42-47 (0.77,0.86,1.06,0.85,0.63,0.78) det	1000	discard	hub-patience: stay patient at hub during deposit when adjacent (2 tile radius); NO CHANGE - backoff already handles timing
e2ecf99	0.825	seeds42-47 (0.77,0.86,1.06,0.85,0.63,0.78) det	1000	discard	hub-stale-count: suppress force-get_heart when stale 2+ times; doom loop still active - stale count resets before effective suppression
75df54b	0.542	seeds42-47 (0.57,0.46,0.38,0.48,0.58,0.78) det	1000	discard	initial-hub-stagger: agent_id-based stagger CATASTROPHIC - delays critical early heart acquisition by 30-90 steps per agent
b644999	0.647	seeds42-47 (0.64,0.71,0.69,0.70,0.65,0.49) det	1000	discard	get-heart-stale-10: stale threshold 20->10; seed43/44/47 CATASTROPHIC; 20 is goldilocks hub patience; seed46 only 0.65 even with shorter waits
56f6d3a_bds1	0.735	seeds42-47 (0.74,0.48,1.21,0.76,0.63,0.59) det	1000	discard	brief-defend-stagger threshold=1: defend 20s after ANY stale get_heart; seed43 CATASTROPHIC 0.48 (hub doom loop prevention delays normal play)
56f6d3a_bds3	0.778	seeds42-47 (0.77,0.86,1.03,0.73,0.63,0.65) det	1000	discard	brief-defend-stagger threshold=3: less aggressive; seed44 drops 1.06->1.03 seed45 0.85->0.73; delays still hurt working seeds
56f6d3a_dld	0.763	seeds42-47 (0.77,0.86,0.93,0.80,0.63,0.59) det	1000	discard	doom-loop-detect defend after 7+ consecutive stale get_heart; unexpected regression vs baseline even though logic never fired - subtle code interaction
56f6d3a_dld3	0.777	seeds42-47 (0.76,0.86,0.92,0.74,0.63,0.75) det	1000	discard	doom-loop-detect threshold=3: counter now persists in _copy_with; fires too eagerly in seed44 (6 fires); 0.92 seed44 catastrophic
56f6d3a_dld7	0.803	seeds42-47 (0.77,0.86,0.96,0.79,0.64,0.80) det	1000	discard	doom-loop-detect threshold=7: seed46+0.01 seed47+0.02 but seed44 still fires 6x drops 1.06->0.96 - net worse
56f6d3a_dtf2	0.762	seeds42-47 (0.78,0.84,0.92,0.85,0.63,0.55) det	1000	discard	defend-timeout-fix-thresh2: override explore->defend after 2+ timeouts; seed47 CATASTROPHIC 0.55 seed44 0.92; defend fires in working seeds too
56f6d3a_hub2	0.658	seeds42-47 (0.75,0.80,0.45,0.72,0.46,0.77) det	1000	discard	hub-token-limit-2: only 2 aligners at hub simultaneously; seed44 CATASTROPHIC 0.45 - prevents critical early-game heart rushes
ddb13d8_a	0.825	seeds42-47 (0.77,0.86,1.06,0.85,0.63,0.78) det	1000	discard	prefer-nearest-alignable: merge neutral+enemy junction sets; NO CHANGE - neutral junctions already nearest in normal gameplay
ddb13d8_b	0.820	seeds42-47 (0.77,0.86,1.06,0.85,0.63,0.73) det	1000	discard	stale-get-heart-explore-for-alignment: redirect explore to explore_for_alignment after get_heart stale; seed47 drops 0.78→0.73
ddb13d8_c	0.753	seeds42-47 (0.74,0.86,1.06,0.85,0.63,0.53) det	1000	discard	team_scarce-min-count-0-filter: suppress routing when any element at 0 deposits; CATASTROPHIC seed47=0.53 - cannot distinguish true vs false zeros
ddb13d8_d	0.810	seeds42-47 (0.77,0.86,1.06,0.75,0.63,0.78) det	1000	discard	blacklist-fix: blacklist actual target junction instead of nearest from current pos; seed45 drops 0.85→0.75 - "wrong" blacklisting was accidentally beneficial
ddb13d8_e	0.825	seeds42-47 (0.77,0.86,1.06,0.85,0.63,0.78) det	1000	discard	enemy-junction-explore-terminate: end explore when enemy junctions found AND has_heart; NO CHANGE - doom loop aligners lack hearts so condition never fires
ddb13d8_f	0.815	seeds42-47 (0.77,0.86,1.06,0.85,0.63,0.73) det	1000	discard	stale-count-explore-direction: use stale_get_heart_count to redirect explore near_hub→for_alignment; WORSE 0.815 - fires in working seeds too
0865775_g	0.818	seeds42-47 (0.77,0.86,1.06,0.85,0.65,0.78) det	1000	discard	hub-approach-coordination: agents announce approach cell via SharedMap; seed46 +0.02 but seed45 unchanged - 0.818 average, slight improvement but not enough
0865775_h	0.825	seeds42-47 (0.77,0.86,1.06,0.85,0.63,0.78) det	1000	discard	explore-timeout-80steps: extend explore from 60→80 step timeout; NO CHANGE - explore terminates naturally before any timeout
0865775_i	0.540	seeds42-47 (0.55,0.86,0.35,0.85,0.63,0.78) det	1000	discard	hub-adjacent-no-move-block: don't add hub-adjacent cells to move_blocked_cells; CATASTROPHIC seed44=0.35 - miners skip hub entirely
0865775_j	0.795	seeds42-47 (0.77,0.86,1.06,0.85,0.63,0.50) det	1000	discard	post-stale-explore-stagger: stagger explore restarts after get_heart stale to reduce hub crowding; seed47 drops 0.78→0.50 CATASTROPHIC
0865775_k	0.825	seeds42-47 (0.77,0.86,1.06,0.85,0.63,0.78) det	1000	discard	blacklist-clear-after-5: clear junction blacklist after 5 consecutive get_heart stales; NO CHANGE - doom loop not caused by blacklisting
da5b60e_L25	0.705	seeds42-47 (0.77,0.86,1.06,0.85,0.63,0.78) det	1000	discard	get_heart_stale_steps=25: independent stale threshold for get_heart; WORSE - higher threshold increases hub crowding
da5b60e_L30	0.728	seeds42-47 (0.77,0.86,1.06,0.85,0.63,0.78) det	1000	discard	get_heart_stale_steps=30: independent stale threshold for get_heart; ALL WORSE than stale=20
da5b60e_L35	0.682	seeds42-47 (0.77,0.86,1.06,0.85,0.63,0.78) det	1000	discard	get_heart_stale_steps=35: all progressively worse as threshold increases
da5b60e_L40	0.663	seeds42-47 (0.77,0.86,1.06,0.85,0.63,0.78) det	1000	discard	get_heart_stale_steps=40: confirmed goldilocks at 20; increasing beyond 20 monotonically worse
e0ab26f_M	0.795	seeds42-47 (0.77,0.86,1.06,0.85,0.63,0.60) det	1000	discard	explore-far-no-junctions: use generic explore (not near_hub) when no friendly junctions known; seed47 drops 0.78→0.60 from missing early hearts
3851ecc_N	0.628	seeds42-47 (0.55,0.86,0.35,0.85,0.63,0.78) det	1000	discard	move-block-agent-aware: clear move_blocked_cells for non-agent-occupied visible cells; CATASTROPHIC seed44=0.35 - junctions have team:cogs tag causing false positives
